"id","cost","category","name","brand","retail_price","department","sku","distribution_center_id"
5676,"12.423.380.004.639.600","Pants & Capris","WHAT GOES AROUND COMES AROUND Women's Colette Pants","What Goes Around Comes Around","24.170.000.076.293.900","Women","3A01FC0853EBEBA94FDE4D1CC6FB842A",10
5678,"53.243.999.876.081.900","Pants & Capris","BCBGMAXAZRIA Women's Maria Woven Sportswear Pant","BCBGMAXAZRIA","108.0","Women","674F3C2C1A8A6F90461E8A66FB5550BA",3
5686,"2.994.981.010.339.270","Pants & Capris","Calvin Klein Jeans Women's Petite Zip Crop Pant","Calvin Klein Jeans","57.930.000.305.175.700","Women","07BB5FDEF1EE99D35EACCCE14F8B5540",8
5703,"4.936.799.989.640.710","Pants & Capris","Blank Nyc Women's Vegan Leather Skinny Pants","[BLANKNYC]","88.0","Women","F7DD39D47C6F28F7877155CCFFAD0192",2
5715,"25.326.000.063.680.100","Leggings","American Apparel Velvet Legging","American Apparel","42.0","Women","6E4243F5511FD6EF0F03E9F386D54403",8
5723,"4.084.800.007.939.330","Leggings","American Apparel Riding Pant","American Apparel","74.0","Women","D94FD74DCDE1AA553BE72C1006578B23",8
5729,"8.482.500.026.468.180","Leggings","Just One French Terry Warm Winter Leggings","Just One","45.426","Women","024677EFB8E4AEE2EAEEF17B54695BBE",6
5742,"6.341.229.883.820.260","Leggings","Soho Apparel Girls Seamless Lady Junior Knitted Jean Legging SL-KJ03","Soho Girls","10.989.999.771.118.100","Women","C7BE03F5D811ED29C328526CA8AB0D61",1
5754,"343.621.005.366.534","Leggings","Hurley Juniors 81 Skinny Legging","Hurley","59.450.000.762.939.400","Women","0DBCF39D413231953D442F2F17F80CD5",1
5755,"6.791.819.866.411.680","Leggings","Rainbow Neon Leggings","Isadora Pacini","10.989.999.771.118.100","Women","840D68CBBBFA627CD4635408A6C82009",1
5780,"2.325.600.006.058.810","Leggings","Bamboo Dreams Cropped Leggings","Yala","38.0","Women","294A8ED24B1AD22EC2E7EFEA049B8737",2
5794,"7.170.479.887.593.980","Leggings","Snow Leopard Print Leggings Rust","Yelete","12.989.999.771.118.100","Women","5D55E7C13B0F4D7CF9D5D55D3AF329C8",2
5809,"18.623.789.894.062.100","Leggings","Women's Premium Stretchy Skinny Pants (Junior Sizes) - Hot Summer Colors Available","Nvie Designs","29.989.999.771.118.100","Women","E68A83370FAACFAB07AE1F8AAF5352BB",1
5813,"7.529.719.884.491.260","Leggings","Black Spandex Big Ripped Opaque Stirrup Leggings","Luxury Divas","11.989.999.771.118.100","Women","069090145D54BF4AA3894133F7E89873",1
5827,"30.910.250.537.166.300","Leggings","Only Hearts Women's Double Knit Legging","Only Hearts","51.950.000.762.939.400","Women","1C208EE88299E7D6D6EFF86E6879384E",1
5837,"9.373.350.474.441.050","Leggings","Capri Leggings Three Quarter Length Cotton Spandex Multiple Colors Available","FineBrandShop","16.950.000.762.939.400","Women","D1E39C9BDA5C80AC3D8EA9D658163967",7
5838,"6.253.309.891.710.570","Leggings","Soho Apparel Girls Seamless Lady Junior Knitted Jean Legging SL-KJ04 Cotton Spandex","Soho Girls","10.989.999.771.118.100","Women","A91BC76C2A6302E573BADEDCBF57BF7A",1
5847,"4.270.889.870.152.470","Leggings","Sexy Legs' Birch Tree Print Fashion Leggings","boxed-gifts","6.989.999.771.118.160","Women","D6AE00D77468471C0FBA3A53A0273891",10
5849,"38.864.000.485.897.000","Leggings","Allegra K Ladies Stretchy Waist Star Pattern Formfitting Black Leggings XS","Allegra K","6.940.000.057.220.450","Women","1B388C8B7C863FDE3F559142FDC123B0",9
5856,"5.558.400.017.023.080","Leggings","Miraclebody Prima Pleated Back Top","Miraclesuit","96.0","Women","10112BDE2BA78E674B21AAA84613BC8E",5
5895,"3.440.999.998.152.250","Leggings","Hard Tail shirred button back knee leggings","Hard Tail","62.0","Women","33853141E0873909BE88F5C3E6144CC6",10
5904,"38.173.000.609.993.900","Leggings","White Seamless Capri Leggings Three Quarter Length","FineBrandShop","5.900.000.095.367.430","Women","05AE14D7AE387B93370D142D82220F1B",7
5913,"13.706.000.033.766.000","Leggings","Plus Size Dark Grey Seamless Leggings","Icon","22.0","Women","941C377C73C0EFED759C993F1B859526",2
5916,"2.468.400.003.015.990","Leggings","Hue Women's Double Knit Leggings - Plus Size","HUE","44.0","Women","C5F441CD5F43EB2F2C024E1F8B5D00CD",2
5922,"2.708.398.108.175.110","Leggings","Levi's Women's Sateen Skinny Legging","Levi's","449.900.016.784.668","Women","D76D8DEEA9C19CC9AAF2237D2BF2F785",4
5926,"10.532.367.775.288.100","Leggings","Lean Mean Legging by Hold Your Haunches 201","Hold Your Haunches","17.097.999.572.753.900","Women","A8A427AFAFDA854020C951467CC2B4B7",10
5930,"4.010.149.899.991.600","Leggings","AN1225 Women's Solid Color Leggings - Hot Pink","AN1225","6.949.999.809.265.130","Women","3B199F42A9909061516B6CE6D334AF6D",2
5952,"49.098.497.745.707.600","Leggings","Allegra K Ladies Autumn Elastic Waist Pure Cropped Leggings Dark Grey XS","Allegra K","86.899.995.803.833","Women","761EFC843FF05AB74ED358713DD51C1B",9
5964,"13.435.889.891.610.100","Leggings","Vivid Florals Mixed Colors Cotton Leggings","Stella Elyse","21.989.999.771.118.100","Women","C67BA7C4C5C0CD4CC3E3A7146FE5C015",1
5977,"24.531.000.025.570.300","Leggings","Sealed With A Kiss Designs Plus Size Zoe Jeggings in Red","Sealed with a Kiss Designs Plus Size","39.0","Women","7EB532AEF980C36170C0B4426F082B87",2
5981,"5.674.319.869.697.390","Leggings","Snow Leopard Animal Print Leggings in Brown Medium/Large","Yelete","9.989.999.771.118.160","Women","ABB9D15B3293A96A3EA116867B2B16D5",2
5984,"3.971.620.024.790.160","Leggings","Allegra K Women Colorful Print Mid Rise Close-fitting Leggings XS","Allegra K","6.980.000.019.073.480","Women","7F2CBA89A7116C7C6B0A769572D5FAD9",9
5986,"4.316.680.045.105.210","Leggings","Allegra K Woman Elastic Waist Sheer Guipure Sides Skinny Pants Leggings Black XS","Allegra K","6.940.000.057.220.450","Women","FD45C64E026040DBCB83395829D2AEA5",9
5993,"7.259.280.059.607.020","Leggings","Allegra K Ladies Low Rise Two Back Pockets Full Length Stretch Cable Leggings White XS","Allegra K","11.920.000.076.293.900","Women","32E0BD1497AA43E02A42F47D9D6515AD",9
6004,"9.181.403.082.174.920","Leggings","David Lerner Women's Welt Pocket Leggings","DAVID Seeds","14.147.000.122.070.300","Women","636EFD4F9AEB5781E9EA815CDD633E52",10
6012,"13.896.000.042.557.700","Leggings","under.me The Leggings","under.me","24.0","Women","4C4C937B67CC8D785CEA1E42CCEA185C",6
6017,"10.038.419.909.277.800","Leggings","Velvet Heart Paisley Women's Fashion Legging","Velvet","17.989.999.771.118.100","Women","FEF6F971605336724B5E6C0C12DC2534",1
6044,"2.657.600.007.392.460","Leggings","C&C California Women's 3/4 Legging","C & C California","44.0","Women","6B39183E7053A0106E4376F4E9C5C74D",10
6057,"5.754.239.880.966.240","Leggings","Women's Seamless form fitting tights with comfortable ribbed waistband","High Style","9.989.999.771.118.160","Women","177DB6ACFE388526A4C7BFF88E1FEB15",2
6070,"1.288.465.047.466.600","Leggings","LeggingsQueen Fancy Floral Leggings","LeggingsQueen","21.950.000.762.939.400","Women","A4DF48D0B71376788FEE0B92746FD7D5",4
6081,"15.175.000.042.654.500","Leggings","American Apparel Youth Patterned Polyester Spandex Legging","American Apparel","25.0","Women","ADF854F418FC96FB01AD92A2ED2FC35C",8
6084,"20.925.000.035.203.900","Leggings","Ozone Women's Side Button Leggings","Ozone","33.75","Women","0D770C496AA3DA6D2C3F2BD19E7B9D6B",5
6089,"24.570.000.076.666.400","Leggings","BambooDreams Women's Cozy Full Length Leggings","Yala","42.0","Women","3BD318565E4ADBE5F4B6ABF2FFEBF3A0",2
6096,"44.735.998.576.819.800","Leggings","Sexy Legs' Watercolor Floral Fashion Leggings","boxed-gifts","6.989.999.771.118.160","Women","E7DFCA01F394755C11F853602CB2608A",10
6112,"19.108.100.494.788.500","Leggings","LeggingsQueen Stripe Skirt Leggings","LeggingsQueen","29.950.000.762.939.400","Women","0B6A27E2BFCB010E762109F0D2E042DC",4
6115,"2.929.129.871.743.610","Leggings","Sexy Legs' Tiger Print Fashion Leggings","boxed-gifts","4.989.999.771.118.160","Women","C77CFD5563C8EC4BFCDE94C09098BA84",10
6130,"4.390.970.088.037.400","Leggings","Allegra K Women Black Elastic Waist Patchwork Tight Pencil Leggings Gold Tone XS","Allegra K","7.610.000.133.514.400","Women","7B99EFBC101A6013D2C710028BCA5CBF",9
6131,"6.447.599.895.381.920","Leggings","Tatoo Always Love Capri Calf Leggings Stretch Purple","SK Hat shop","9.949.999.809.265.130","Women","392526094BCBA21AF9FD4102CE5ED092",2
6139,"4.441.990.082.239.950","Leggings","Allegra K Ladies Stretch Winter Warm Skinny Tights Pants Black S","Allegra K","7.130.000.114.440.910","Women","618FAA1728EB2EF6E3733645273AB145",9
6141,"14.994.950.496.890.000","Leggings","LeggingsQueen B.B Leggings","LeggingsQueen","24.950.000.762.939.400","Women","13D2B7361A27DBC9960AE158598A6A96",4
6153,"14.770.400.479.358.000","Leggings","LeggingsQueen Z-Star Leggings","LeggingsQueen","24.950.000.762.939.400","Women","A4D5FAD84EE90C1308CC37B52135D5DB",4
6182,"11.132.100.466.744.600","Leggings","LeggingsQueen Winter Basic Napping Leggings","LeggingsQueen","19.950.000.762.939.400","Women","4C5A99856A3C634A5A3BEAE02520CDC2",4
6196,"7.148.399.908.608.190","Leggings","Thin Summer Leggings Stretchy Crystals Studded Blue","SK Hat shop","12.949.999.809.265.100","Women","F169B1A771215329737C91F70B5BF05C",2
6216,"7.712.500.030.174.850","Leggings","Ladies Tan Animal Printed Leggings","FineBrandShop","45.424","Women","619427579E7B067421F6AA89D4A8990C",7
6221,"7.541.379.761.311.110","Leggings","New Lady's White 100% Poly Stretch Leggings L0644 - Large L/XL 5'1-5'10 height","Dapper World","12.979.999.542.236.300","Women","ABD987257FF0EDDC2BC6602538CB3C43",5
6226,"9.619.499.791.126.690","Leggings","Anna-Kaci S/M Fit Red White and Blue Patriotic Inspired High Waisted Leggings","Anna-Kaci","15.899.999.618.530.200","Women","ADFE565BB7839B83EA8812E860D73C79",7
6227,"879.269.983.832.836","Leggings","Anna-Kaci S/M Fit Yellow Bright Neon High Waisted Slim Leg Ankle Length Leggings","Anna-Kaci","15.899.999.618.530.200","Women","56F0B515214A7EC9F08A4BBF9A56F7BA",7
6229,"9.921.599.788.972.730","Leggings","Anna-Kaci Small Fit Brown Snakeskin Print Stretch Body Forming Leggings Pants","Anna-Kaci","15.899.999.618.530.200","Women","BCE9ABF229FFD7E570818476EE5D7DDE",7
6241,"808.766.010.102.272","Leggings","Allegra K Women Winter Plush Lining Stretchy Thick Leggings Tights Pants Black XS","Allegra K","14.090.000.152.587.800","Women","154F596A0E4AEC4CF23EE4B76AE3D34A",9
6243,"3.984.500.011.429.190","Leggings","Zocks Women's Black Footless Legging Stretchy Tight Size M/L","ZOCKS","45.418","Women","B4EDDA67F0F57E218A8E766927E3E5C5",2
6254,"8.308.500.011.451.540","Leggings","Foot Traffic Black Legging with Gems","Foot Traffic","45.426","Women","8617F303DD11780C5D48AEDF0BD90823",6
6256,"5.864.129.877.853.090","Leggings","Tight Leopard Print Leggings - Blue-Grey/White - Size Medium/Large","Yelete","9.989.999.771.118.160","Women","A87C11B9100C608B7F8E98CFA316FF7B",2
6270,"27.758.831.144.219.300","Leggings","Levi's Women's Sateen Super Skinny Legging","Levi's","449.900.016.784.668","Women","75A7E9D83024B7CE00FE9CD2AA0BD0C5",4
6273,"15.637.260.777.896.000","Shorts","Levi's Women's 515 Bermuda Short","Levi's","329.900.016.784.668","Women","619953730129049907919279F29BD9D7",4
6299,"13.125.000.009.313.200","Shorts","Silver Jeans Juniors Toni Perfect Inseam Short","Silver Jeans","25.0","Women","FF0ABBCC0227C9124A804B084D161A2D",1
6306,"13.494.599.854.061.000","Shorts","Woman Within Plus Size Shorts denim drawstring waist","Woman Within","24.989.999.771.118.100","Women","958AD0D05D3259750BE0B041D10ADBB1",5
6308,"11.574.999.988.079.000","Shorts","Dockers Women's Utility Promo Short","Dockers","25.0","Women","EB21CC0143D96DBC8E3A58F1A81E4DD2",7
6317,"28.899.780.545.906.400","Shorts","Carhartt Women's Trail Utility Short","Carhartt","60.970.001.220.703.100","Women","0E9B734AA25CA8096CB7B56DC0DD8929",3
6334,"20.071.339.580.397.900","Shorts","Carhartt Women's Curvy-Fit Denim Short","Carhartt","44.209.999.084.472.600","Women","D0CFFA36E832B65FE145A6E9360BDA83",3
6343,"17.855.300.814.353.600","Shorts","ROXY Desert Sol Womens Denim Shorts","Roxy","379.900.016.784.668","Women","A3A3E8B30DD6EADFC78C77BB2B8E6B60",2
6344,"7.951.999.999.582.760","Shorts","Sabree Missy Cargo Short","Sabree","16.0","Women","DB5F9F42A7157ABE65BB145000B5871A",1
6349,"5.258.948.181.938.050","Shorts","True Religion Brand Jeans Women's Jayde Boyfriend Denim Shorts - Pink","True Religion","999.800.033.569.336","Women","8C5149362E6E7F7947FD2F578DF6B575",7
6354,"15.670.250.784.981.900","Shorts","Dockers Women's Petite Shadow Stitch Bermuda","Dockers","329.900.016.784.668","Women","7792A0500B5AABB4B072D113A160D200",7
6356,"3.420.400.000.177.320","Shorts","Pendleton Women's Sunnyside Shorts","Pendleton","68.0","Women","495360CBF18A7D5004FF72F49254E069",9
6359,"13.125.000.009.313.200","Shorts","Rich & Skinny Women's Hampton Short","Rich & Skinny","25.0","Women","51DB672AC302A163017367F46D48F602",4
6370,"13.100.000.005.215.400","Shorts","Calvin Klein Jeans Women's Web Belt Skimmer Pant","Calvin Klein Jeans","25.0","Women","6FFCC0D3641930E3D8980EC43343CCC5",8
6380,"1.619.200.000.166.890","Shorts","Plus Size Dark Denim Short","Mwak","32.0","Women","2F635A9FE4A4D8D1EC9E3A111CC02F4B",3
6387,"18.008.400.813.876.000","Shorts","Lee Women's Plus-Size Emmie Bermuda Comfort Fit Short","Lee","34.900.001.525.878.900","Women","AD7ED5D47B9BACEB12045A929E7E2F66",5
6397,"5.312.999.989.837.400","Shorts","!iT Jeans Women's Bonaroo Slouch Shorts","!it Jeans","11.0","Women","5E62D03AEC0D17FACFC5355DD90D441C",2
6400,"5.616.499.918.367.710","Shorts","Charcoal French Terry Shorts with Drawstring and Side Pockets","FineBrandShop","11.949.999.809.265.100","Women","D6DABCC412981D56C8733B52586A9D44",7
6406,"12.125.000.008.381.900","Shorts","Calvin Klein Jeans Women's Denim Short","Calvin Klein Jeans","25.0","Women","99CAD265A1768CC2DD013F0E740300AE",8
6425,"21.530.559.474.157.600","Shorts","Jones New York Plain Front Shorts","Jones New York","44.119.998.931.884.700","Women","93963474EDFD08F1F1E7244F663B4708",3
6437,"22.789.650.396.522.500","Shorts","Eddie Bauer Curvy Blakely Legend Wash Shorts","Eddie Bauer","44.950.000.762.939.400","Women","498F2C21688F6451D9F5FD09D53EDDA7",2
6441,"1.843.973.090.905.740","Shorts","Ed Garments Women's Pleated Chino Short. 8479","Ed Garments","349.900.016.784.668","Women","0B07C4AABFDC28BB8236E195C401E1B2",7
6457,"24.231.999.903.917.300","Shorts","Hurley Juniors Phantom 2.5 Inch Lowrider Walkshort","Hurley","52.0","Women","D465F14A648B3D0A1FAA6F447E526C60",1
6466,"6.417.199.906.218.050","Shorts","Allegra K Woman Black Worsted Bow Rhinestud Detail Slant Pockets Shorts M","Allegra K","12.199.999.809.265.100","Women","219C507B38DDFC07899FC1F01FF40C44",9
6484,"13.425.000.011.920.900","Shorts","BCBGeneration Women's Loop and Button Short","BCBGeneration","25.0","Women","CFA45151CCAD6BF11EA146ED563F2119",8
6490,"217.979.999.743.402","Shorts","Hurley Juniors Lowrider Novelty 7 Inch Bermuda Short","Hurley","42.0","Women","3D387D2612F9027154ED3B99A7427DA1",1
6499,"14.993.999.993.428.500","Shorts","Hurley Juniors Lowrider YC Stretch Denim Short","Hurley","45.443","Women","6E0917469214D8FBD8C517DCDC6B8DCF",1
6533,"1.852.650.001.645.080","Shorts","Torrid Plus Size Olive Belted Poplin Shorts","Torrid","34.5","Women","90FD26A243F6D14C4B3DF082CDC8DA66",9
6542,"1.294.999.998.062.840","Shorts","KUT from the Kloth Women's 5 Pocket Bermuda Short","KUT from the Kloth","25.0","Women","F56D8183992B6C54C92C16A8519A6E2B",8
6543,"12.149.999.989.196.600","Shorts","Robbi & Nikki Women's Reptile Print Short","Robbi & Nikki","25.0","Women","12BCD658EF0A540CABC36CDF2B1046FD",5
6547,"3.295.999.997.854.230","Shorts","allen allen Women's Stitched Waist Cargo Short","Allen Allen","64.0","Women","8C620C2FAAAFD489B4C45B448ACAC3A0",7
6551,"12.188.999.800.108.300","Shorts","Anna-Kaci S/M Fit Denim Blue Stars and Stripes Patriotic USA Summer Beach Shorts","Anna-Kaci","23.899.999.618.530.200","Women","01922CBEAE89AD4D79AB769E84E7C5DA",7
6580,"23.496.000.081.300.700","Shorts","Dockers Women's Button Pocket Promo Bermuda","Dockers","44.0","Women","1EF03ED0CD5863C550128836B28EC3E9",7
6606,"17.979.550.973.755.100","Shorts","Levi's Women's Cut Off Featuring A Frayed Hem 4-Inch Inseam Short","Levi's","329.900.016.784.668","Women","B14573B9273C38BA0F89BB63ABC87973",4
6607,"25.987.500.018.440.100","Shorts","Women's American Eagle Outfitters Skinny Bermuda Dark Denim Shorts","American Eagle","49.5","Women","7CAF5E22EA3EB8175AB518429C8589A4",2
6610,"10.128.019.842.873.800","Shorts","PAIGE Women's Jimmy Jimmy Short Jean","PAIGE","19.819.999.694.824.200","Women","94739E5A5164B4D2396E253A11D57044",7
6622,"13.075.000.001.117.500","Shorts","KUT from the Kloth Women's Boyfriend Animal Short","KUT from the Kloth","25.0","Women","4D0505284AC5049B4167EB7EBFE0791B",8
6624,"15.263.999.998.569.400","Shorts","Plus Size Funky Fade Shorts","Revolt Jeans","32.0","Women","781877BDA0783AAC5F1CF765C128B437",3
6627,"249.950.008.392.334","Shorts","Juicy Couture Evelyn Denim Sailor Shorts Cuffed New","Juicy Couture","499.900.016.784.668","Women","0224CD598E48C5041C7947FD5CB20D53",6
6657,"1.907.999.997.586.010","Shorts","Flying Monkey Jeans KL54 Vintage Shorts - White","Flying Monkey Jeans","36.0","Women","2F73168BF3656F697507752EC592C437",10
6659,"2.115.471.085.453.860","Shorts","Mango Women's Velvet Shorts - Ginette","MANGO","399.900.016.784.668","Women","FB1378D0B80AE44AAE0000A3CFF0B90F",9
6663,"21.881.999.988.108.800","Shorts","Hurley Juniors Lowrider Trouser Short","Hurley","42.0","Women","0EF41260A5B096182EE7E45B942CD46D",1
6667,"4.854.340.039.218.160","Shorts","Allegra K Woman Ruffled Two Pockets Front Zip Up Mini Shorts Black M","Allegra K","9.670.000.076.293.940","Women","8F97D1D7E02158A83CEB2C14FF5372CD",9
6673,"1.960.050.001.740.450","Shorts","Fox Juniors Intensity Short","Fox","36.5","Women","580760FB5DEF6E2CA8EAF601236D5B08",6
6683,"11.299.999.989.569.100","Shorts","See Thru Soul Juniors Sailor Bermuda Short","See Thru Soul","25.0","Women","4670C07872D5314C6AD6FFA633D4A059",10
6692,"7.781.419.904.792.600","Shorts","Mango Women's Frayed Denim Shorts - Eva","MANGO","16.989.999.771.118.100","Women","B154E7B21B2FF0A14D96AFFA6D3FB958",9
6695,"6.926.399.977.505.200","Shorts","AG Adriano Goldschmied Women's City Short","AG Adriano Goldschmied","148.0","Women","2EA1202AED1E0CE30D41BE4919B0CC99",4
6711,"71.249.999.944.120.600","Shorts","HEART SOUL Stretch Button Dress Shorts W/ Pockets [576421YJ22]","HEART SOUL","15.0","Women","50982FB2F2CFA186D335310461DFA2BE",3
6715,"17.902.499.994.263.000","Shorts","Roxy Junior's Nomad Solid Short","Roxy","38.5","Women","38FAAE069A1371784081EA9AD9B279D0",2
6716,"1.830.480.041.514.030","Shorts","Billabong Keep On Short - Women's","Billabong","39.450.000.762.939.400","Women","9FC64354454711C97058DB6110B3A369",9
6727,"6.974.999.997.764.820","Shorts","JOU JOU Stretch Premium Denim Shorts W/ Buckled Tab & Printed Sash Belt [237-594 B]","Jou Jou","15.0","Women","AD5AB36761669D6EADBAEE691C4A1D22",1
6740,"13.625.000.044.703.400","Shorts","See Thru Soul Juniors Skinny Boyfriend Fashionable Short","See Thru Soul","25.0","Women","3E98410C45EA98ADDEC555019BBAE8EB",10
6763,"5.593.909.879.241.280","Shorts","Hyp Sportswear Women's Vintage Look Greenville French Terry Shorts. HY302","HYP","10.989.999.771.118.100","Women","6F683B372CC7EACB980EC61B736CAC74",8
6772,"4.713.360.075.875.520","Shorts","Allegra K Ladies Bow Tie Decor Strap Front Two Pockets Front Black Pleated Shorts S","Allegra K","984.000.015.258.789","Women","2639C6BD2A42E714227B06646829D6EA",9
6787,"11.950.000.002.980.200","Shorts","frankie b. Women's Summer Girl Short","Frankie B.","25.0","Women","FCF1D8D2F36C0CDE8ECA4B86A8FE1DF8",2
6794,"21.349.770.318.546.800","Shorts","Lilly Pulitzer Women's Callahan Short","Lilly Pulitzer","4.211.000.061.035.150","Women","2E5AC40B5A02C5A2C35FE028A266AA91",9
6795,"32.968.098.958.791.700","Shorts","Allegra K Woman Studded Detail Elastic Waist Split Skirt Skort Shorts Black S","Allegra K","696.999.979.019.165","Women","E074A2975740CDF3948CFC063892260E",9
6810,"11.950.000.002.980.200","Shorts","Joie Women's Layana Terry Short","Joie","25.0","Women","4F1927FFF6E092185D6A6F4C8466E421",2
6816,"7.014.299.912.025.030","Shorts","LOVEsick Black And White Snake Shorts","Hot Topic","15.449.999.809.265.100","Women","8383F931B0CEFCC631F070480EF340E1",10
6824,"16.997.400.454.445.100","Shorts","Volcom Lives Short - Women's","Volcom","31.950.000.762.939.400","Women","DE58BFE3D33DADA41A9398C30E21EEED",4
6827,"22.428.000.077.605.200","Shorts","Dockers Women's Petite Cargo Promo Short","Dockers","42.0","Women","4A1C2F4DCF2BF76B6B278AE40875D536",7
6830,"12.470.009.884.601.000","Shorts","RSQ New Edge Womens Shorts","RSQ","24.989.999.771.118.100","Women","5E9FB672EE46BE628A141B594D7C6F3E",3
6851,"2.154.541.979.346.600","Shorts","Silver Jeans - Mckenzie Rolled Cuff Denim Shorts","Silver Jeans","4.497.999.954.223.630","Women","478D04447429F265A85D7568B0A602B5",1
6854,"4.817.748.081.855.890","Shorts","Ted Baker Women's Gleeso Rosebug Print Short","Ted Baker","9.022.000.122.070.310","Women","2BA2520186EE376E835CE7BF1554EF7B",3
6874,"38.517.919.111.536.700","Shorts","Patterson J. Kincaid Women's Welt Ribbon Short","Patterson J. Kincaid","8.091.999.816.894.530","Women","5D50D22735A7469266AAB23FD8AEB536",5
6883,"22.584.980.846.864.100","Shorts","Fox Juniors Dylan Four Pocket Short","Fox","449.900.016.784.668","Women","A577DAD7E00EAAD256C112C836F55B11",6
6891,"2.141.999.999.061.220","Shorts","ONEILL W APPAREL Juniors Sunbeam Ripstop Shorts","O'Neill","42.0","Women","83DA7C539E1AB4E759623C38D8737E9E",8
6897,"1.843.999.996.781.340","Shorts","DC Junior's Bennett Short Dark Indigo Rinse","DC","40.0","Women","E32CC80BF07915058CE90722EE17BB71",4
6905,"11.544.000.014.662.700","Shorts","Volcom Frochickie 2 1/2 Shorts Watermelon Print Womens","Volcom","24.0","Women","F19EC2B84181033BF4753A5A51D5D608",4
6941,"5.928.459.831.380.240","Shorts","Allegra K Woman Button Closure Zip Fly Ripped Mini Denim Shorts Dark Blue XS","Allegra K","12.859.999.656.677.200","Women","AAD64398A969EC3186800D412FA7AB31",9
6943,"20.617.740.397.269.100","Shorts","[BLANKNYC] Women's Happy Trail Denim Shorts","[BLANKNYC]","3.861.000.061.035.150","Women","6A783B626A6D892A132DC195E5504272",2
6948,"53.703.000.879.220.600","Shorts","Allegra K Ladies Low Waist Fake Pockets Shorts w Bow Tie Belt Watermelon Red S","Allegra K","11.050.000.190.734.800","Women","FF7A2112F8C3E3224CE8E3E26DE1D932",9
6959,"548.549.999.948.591","Shorts","Ladies Blue Woven Cotton Shorts","FineBrandShop","45.423","Women","481263854FACF41A2F8A64A21956D87B",7
6963,"7.756.650.039.516.760","Shorts","Indigo Rein Pleated Front Denim Short","Indigo Rein","15.670.000.076.293.900","Women","6F5E4E86A87220E5D361AD82F1EBC335",4
6969,"13.659.099.810.111.800","Shorts","Hurley - Hurley Girls Shorts - Lowrider Novelty","Hurley","27.649.999.618.530.200","Women","7813D1590D28A7DD372AD54B5D29D033",1
6973,"3.491.399.994.492.530","Shorts","LIJA Women's Paradox Plaid Knee Short","LIJA","66.0","Women","FAA98789CFB692431FFB52E13497443A",10
6979,"30.502.080.242.211.000","Shorts","Horny Toad Women's Morse Long Short","Horny Toad","6.052.000.045.776.360","Women","B6A8CDD64382383F29FAC327A8292096",1
6998,"7.443.250.030.402.090","Shorts","Grane Supergirl Shorts","Grane","15.670.000.076.293.900","Women","3D4893419E57449FB290647149F738D4",2
6999,"18.403.280.758.538.500","Shorts","Ed Garments Women's Classic Cut Pleated Twill Short. 8419","Ed Garments","389.900.016.784.668","Women","31C23973A376C90940F5F5FF2118B5D2",7
7000,"15.520.000.010.728.800","Shorts","Jag Jeans Aria Bermuda Short","JAG Jeans","32.0","Women","708BE71B9AB6E0A84252760579ADE9F1",4
7016,"7.560.000.002.849.840","Shorts","The Lady eM Boutique Blue Jean Dress Shorts","Kari's Fashion","15.0","Women","6E0FF6E4617EF3586D31B86BBF141011",6
7042,"26.211.150.361.465.600","Shorts","Isis Women's Roll-Back Short","Isis","54.950.000.762.939.400","Women","8C66BB19847DD8C21413C5C8C9D68306",10
7050,"10.712.400.334.960.200","Shorts","Oneill Juniors Dingo Short","O'Neill","23.700.000.762.939.400","Women","0F7B2BB5D0C7E6209ECFF113108F64CF",8
7051,"3.542.500.011.622.900","Shorts","Cotton Twill Bermuda Shorts with Curved Pockets","Nantucket Brand","65.0","Women","BA3C736667394D5082F86F28AEF38107",1
7058,"14.853.040.832.481.300","Shorts","Blank Nyc Women's Deep Tissue Shorts","[BLANKNYC]","3.208.000.183.105.460","Women","696186D1596721CB6E79013D4655C5D9",2
7061,"21.647.999.983.280.800","Shorts","American Apparel Unisex Striped Chambray Kool Short","American Apparel","44.0","Women","6495CF7CA745A9443508B86951B8E33A",8
7108,"722.369.982.238.412","Skirts","Black Fold-Over Maxi Jersey Skirt","FineBrandShop","19.899.999.618.530.200","Women","5BCA8566DB79F3788BE9EFD96C9ED70D",7
7110,"6.987.629.883.776.300","Skirts","Alki'i A-Lined Mid Length Skirt with Elastic Waistband","Alki'i","15.989.999.771.118.100","Women","7DA9FD85999F583E3906F99A3EE58911",1
7113,"8.941.739.882.478.710","Skirts","VIP Boutique Womens Black Ladies Belted Gypsy Long Maxi Skirt","VIP BOUTIQUE","20.989.999.771.118.100","Women","3501672EBC68A5524629080E3EF60AEF",5
7114,"9.735.899.823.388.450","Skirts","Charcoal Fold-Over Maxi Jersey Skirt","FineBrandShop","24.899.999.618.530.200","Women","20D039F53B4A6786C21EE0DBCD2D2C5D",7
7158,"1.679.599.992.185.830","Skirts","My Michelle Juniors Bubble Skirt","My Michelle","38.0","Women","AF0A59D77EDF6E178EC25CB090DF864B",6
7161,"2.246.399.998.664.850","Skirts","Neon Buddha Women's Retro Rouched Skirt","Neon Buddha","64.0","Women","8860A4E27CBBE4C63821B429211684A3",1
7162,"11.249.999.981.373.500","Skirts","A. Byer Juniors Pegged Skirt With Button Yoke","A. Byer","25.0","Women","7DD3ED2E12D7967B656D156D50308263",1
7166,"2.039.999.994.635.580","Skirts","BCBGeneration Women's Pullover Skirt","BCBGeneration","48.0","Women","19F01591B6CA3BA03F1AEDC8DB12CDB9",8
7173,"10.470.809.851.592.900","Skirts","Woman Within Plus Size Petite flare skirt","Woman Within","24.989.999.771.118.100","Women","162D18156ABE38A3B32851B72B1D44F5",5
