"id","cost","category","name","brand","retail_price","department","sku","distribution_center_id"
1,"2.704.799.991.566.680","Tops & Tees","Seven7 Women's Long Sleeve Stripe Belted Top","Seven7","49.0","Women","C4CA4238A0B923820DCC509A6F75849B",1
3,"41.004.999.860.189.800","Tops & Tees","Calvin Klein Jeans Women's Solid Flyaway Shirt","Calvin Klein Jeans","69.5","Women","ECCBC87E4B5CE2FE28308FD9F2A7BAF3",8
50,"3.111.849.989.183.240","Tops & Tees","Calvin Klein Women's MSY 3/4 Sleeve Top","Calvin Klein","59.5","Women","C0C7C76D30BD3DCAEFC96F40275BDC0A",3
71,"905.339.998.304.844","Tops & Tees","Plenty by Tracy Reese Women's Easy Shirt","Plenty by Tracy Reese","158.0","Women","E2C420D928D4BF8CE0FF2EC19B371514",1
78,"41.039.999.887.347.200","Tops & Tees","Splendid Women's Boxy Pocket Top","Splendid","72.0","Women","35F4A8D465E6E1EDC05F3D8AB658C551",10
80,"29.429.999.945.685.200","Tops & Tees","Democracy Women's French Terry Top with Contrast Woven Shoulder and Laser Cut Design","Democracy","54.0","Women","F033AB37C30201F73F142449D037028D",2
90,"5.903.040.066.120.620","Tops & Tees","Wilt Women's Long Sleeve Back Slant","Wilt","11.440.000.152.587.800","Women","8613985EC49EB8F757AE6439E879BB2A",6
111,"13.344.659.830.857.200","Tops & Tees","Mango Women's Printed T-Shirt With Bows - Colibri-N","MANGO","24.989.999.771.118.100","Women","698D51A19D8A121CE581499D7B701668",9
118,"25.467.220.628.528.500","Tops & Tees","Kenneth Cole Women's 3/4 Sleeve Tiered Top","Kenneth Cole","46.220.001.220.703.100","Women","5EF059938BA799AAA845E1C2E8A762BD",6
129,"16.254.579.858.964.300","Tops & Tees","Woman Within Plus Size Top 2-in-1 t-shirt with lace trim","Woman Within","29.989.999.771.118.100","Women","D1F491A404D6854880943E5C3CD9CA25",5
139,"31.551.999.878.138.300","Tops & Tees","allen allen Women's Rugby Stripe Long Sleeve Thumbhole Tee","Allen Allen","58.0","Women","E00DA03B685A0DD18FB6A08AF0923DE0",7
148,"27.094.580.881.422.400","Tops & Tees","Alternative Ladies' Rib-Sleeve Scoopneck Long-Sleeve T-Shirt with Thumbholes","Alternative","499.900.016.784.668","Women","47D1E990583C9C67424D369F3414728E",2
174,"1.568.476.982.577.470","Tops & Tees","Chestnut Hill Ladies Performance Plus Long Sleeve Twill. CH605W","Chestnut Hill","29.989.999.771.118.100","Women","BF8229696F7A3BB4700CFDDEF19FA23F",7
186,"15.836.679.704.840.900","Tops & Tees","Patty Women Unique Corset Embroidered Back Cap Sleeve Boho Clubwear Blouse Top","Patty","27.979.999.542.236.300","Women","9872ED9FC22FC182D371C3E9ED316094",1
186,"15.836.679.704.840.900","Tops & Tees","Patty Women Unique Corset Embroidered Back Cap Sleeve Boho Clubwear Blouse Top","Patty","27.979.999.542.236.300","Women","9872ED9FC22FC182D371C3E9ED316094",1
188,"11.850.300.463.293.400","Tops & Tees","2 or 4 Pack: Zenana Cami Sets Many Colors Available 22","Zenana","19.950.000.762.939.400","Women","9DCB88E0137649590B755372B040AFAD",2
191,"13.619.549.850.123.700","Tops & Tees","Asics Women's Core Short Sleeve Shirt","ASICS","24.989.999.771.118.100","Women","0AA1883C6411F7873CB83DACB17B0AFC",1
191,"13.619.549.850.123.700","Tops & Tees","Asics Women's Core Short Sleeve Shirt","ASICS","24.989.999.771.118.100","Women","0AA1883C6411F7873CB83DACB17B0AFC",1
196,"6.366.689.872.389.130","Tops & Tees","Women's 17 inches camisole tank top with built-in bra and adjustable straps","High Style","11.989.999.771.118.100","Women","084B6FBB10729ED4DA8C3D3F5A3AE7C9",2
196,"6.366.689.872.389.130","Tops & Tees","Women's 17 inches camisole tank top with built-in bra and adjustable straps","High Style","11.989.999.771.118.100","Women","084B6FBB10729ED4DA8C3D3F5A3AE7C9",2
213,"7.711.200.237.880.640","Tops & Tees","Next Level Apparel Ladies Extreme Soft V-Neck T-Shirt. 3400L","Next Level","13.770.000.457.763.600","Women","979D472A84804B9F647BC185A877A8B5",6
213,"7.711.200.237.880.640","Tops & Tees","Next Level Apparel Ladies Extreme Soft V-Neck T-Shirt. 3400L","Next Level","13.770.000.457.763.600","Women","979D472A84804B9F647BC185A877A8B5",6
222,"1.498.265.968.215.100","Tops & Tees","Patty Women Fitted One shoulder Ruched Arm Long Sleeve Blouse Top","Patty","28.979.999.542.236.300","Women","BCBE3365E6AC95EA2C0343A2395834DD",1
222,"1.498.265.968.215.100","Tops & Tees","Patty Women Fitted One shoulder Ruched Arm Long Sleeve Blouse Top","Patty","28.979.999.542.236.300","Women","BCBE3365E6AC95EA2C0343A2395834DD",1
245,"5.478.199.986.391.700","Tops & Tees","Lilly Pulitzer Women's Noelle Tunic","Lilly Pulitzer","98.0","Women","0266E33D3F546CB5436A10798E657D97",9
245,"5.478.199.986.391.700","Tops & Tees","Lilly Pulitzer Women's Noelle Tunic","Lilly Pulitzer","98.0","Women","0266E33D3F546CB5436A10798E657D97",9
249,"1.745.417.982.299.590","Tops & Tees","Ayurvastram Pure Cotton Shirt Tunic Top Kurti","Ayurvastram","29.989.999.771.118.100","Women","077E29B11BE80AB57E1A2ECABB7DA330",8
252,"13.694.519.838.451.800","Tops & Tees","Woman Within Plus Size Top tunic length in softest sweatshirt fleece","Woman Within","24.989.999.771.118.100","Women","03C6B06952C750899BB03D998E631860",5
252,"13.694.519.838.451.800","Tops & Tees","Woman Within Plus Size Top tunic length in softest sweatshirt fleece","Woman Within","24.989.999.771.118.100","Women","03C6B06952C750899BB03D998E631860",5
267,"8.700.120.003.008.390","Tops & Tees","Next Level The Deep V","Next Level","15.210.000.038.146.900","Women","EDA80A3D5B344BC40F3BC04F65B7A357",6
267,"8.700.120.003.008.390","Tops & Tees","Next Level The Deep V","Next Level","15.210.000.038.146.900","Women","EDA80A3D5B344BC40F3BC04F65B7A357",6
280,"7.568.589.865.960.030","Tops & Tees","Woman Within Plus Size Top Perfect t-shirt with crew neck","Woman Within","13.989.999.771.118.100","Women","92C8C96E4C37100777C7190B76D28233",5
280,"7.568.589.865.960.030","Tops & Tees","Woman Within Plus Size Top Perfect t-shirt with crew neck","Woman Within","13.989.999.771.118.100","Women","92C8C96E4C37100777C7190B76D28233",5
290,"18.431.999.936.699.800","Tops & Tees","Danskin Women's Ice Stripes Fitness Tank","Danskin","36.0","Women","F90F2ACA5C640289D0A29417BCB63A37",2
299,"16.361.999.966.204.100","Tops & Tees","Volcom Juniors Pocket Blocket Long Sleeve Tee","Volcom","27.0","Women","EF0D3930A7B6C95BD2B32ED45989C61F",4
320,"5.449.500.044.614.070","Tops & Tees","Allegra K Lady Burgundy Boat Neck Bead Accent Off Shoulder Top S","Allegra K","10.380.000.114.440.900","Women","320722549D1751CF3F247855F937B982",9
320,"5.449.500.044.614.070","Tops & Tees","Allegra K Lady Burgundy Boat Neck Bead Accent Off Shoulder Top S","Allegra K","10.380.000.114.440.900","Women","320722549D1751CF3F247855F937B982",9
322,"15.094.750.472.731.800","Tops & Tees","Doctor Who T-Shirt - Logo of Words Black Junior Tee","Doctor Who","24.950.000.762.939.400","Women","5737C6EC2E0716F3D8A7A5C4E0DE0D9A",3
322,"15.094.750.472.731.800","Tops & Tees","Doctor Who T-Shirt - Logo of Words Black Junior Tee","Doctor Who","24.950.000.762.939.400","Women","5737C6EC2E0716F3D8A7A5C4E0DE0D9A",3
326,"5.029.499.945.670.360","Tops & Tees","Allegra K Lady Woman Boat Neck Short Batwing Sleeve Loose T Shirt","Allegra K","9.579.999.923.706.050","Women","A666587AFDA6E89AEC274A3657558A27",9
326,"5.029.499.945.670.360","Tops & Tees","Allegra K Lady Woman Boat Neck Short Batwing Sleeve Loose T Shirt","Allegra K","9.579.999.923.706.050","Women","A666587AFDA6E89AEC274A3657558A27",9
328,"44.847.701.107.296.300","Tops & Tees","Allegra K Women Off Shoulder Long Sleeve Stretchy Tunic Shirt Black XS","Allegra K","8.510.000.228.881.830","Women","CD00692C3BFE59267D5ECFAC5310286C",9
334,"22.394.400.886.310.600","Tops & Tees","Devon & Jones Classic Ladies' Premium Twill. D590W","Devon & Jones","399.900.016.784.668","Women","2F2B265625D76A6704B08093C652FD79",7
362,"121.739.098.081.851","Tops & Tees","Next Level 4501 - Ladies' Long Sleeve Cotton Burnout Combo T-Shirt","Next Level","19.989.999.771.118.100","Women","C3E878E27F52E2A57ACE4D9A76FD9ACF",6
362,"121.739.098.081.851","Tops & Tees","Next Level 4501 - Ladies' Long Sleeve Cotton Burnout Combo T-Shirt","Next Level","19.989.999.771.118.100","Women","C3E878E27F52E2A57ACE4D9A76FD9ACF",6
364,"7.144.739.962.125.420","Tops & Tees","Allegra K Women Boat Neck Off Shoulder Tunic Shirt Black White Gray XS","Allegra K","11.789.999.961.853.000","Women","BAC9162B47C56FC8A4D2A519803D51B3",9
364,"7.144.739.962.125.420","Tops & Tees","Allegra K Women Boat Neck Off Shoulder Tunic Shirt Black White Gray XS","Allegra K","11.789.999.961.853.000","Women","BAC9162B47C56FC8A4D2A519803D51B3",9
365,"3.979.196.871.971.960","Tops & Tees","Dare To Wear Gothic Victorian Women's Plus Size Electra Corset Top","Dare to Wear","6.598.999.786.376.950","Women","9BE40CEE5B0EEE1462C82C6964087FF9",2
382,"1.755.701.970.770.530","Tops & Tees","Patty Women Cowl Neck Off Shoulders Long Sleeves Top","Patty","31.979.999.542.236.300","Women","4F6FFE13A5D75B2D6A3923922B3922E5",1
382,"1.755.701.970.770.530","Tops & Tees","Patty Women Cowl Neck Off Shoulders Long Sleeves Top","Patty","31.979.999.542.236.300","Women","4F6FFE13A5D75B2D6A3923922B3922E5",1
396,"17.034.319.841.170.900","Tops & Tees","Ed Hardy Womens NYC Long Sleeve Tee Shirt-Black","Ed Hardy","29.989.999.771.118.100","Women","F8C1F23D6A8D8D7904FC0EA8E066B3BB",5
396,"17.034.319.841.170.900","Tops & Tees","Ed Hardy Womens NYC Long Sleeve Tee Shirt-Black","Ed Hardy","29.989.999.771.118.100","Women","F8C1F23D6A8D8D7904FC0EA8E066B3BB",5
397,"10.939.499.974.774.600","Tops & Tees","G by GUESS Joni Love Tee","G by GUESS","45.431","Women","E46DE7E1BCAACED9A54F1E9D0D2F800D",3
397,"10.939.499.974.774.600","Tops & Tees","G by GUESS Joni Love Tee","G by GUESS","45.431","Women","E46DE7E1BCAACED9A54F1E9D0D2F800D",3
404,"7.540.679.920.064.910","Tops & Tees","Allegra K Woman Gray Boat Neck Bating Long Sleeves Autumn Shirt Blouse S","Allegra K","13.369.999.885.559.000","Women","4F4ADCBF8C6F66DCFC8A3282AC2BF10A",9
404,"7.540.679.920.064.910","Tops & Tees","Allegra K Woman Gray Boat Neck Bating Long Sleeves Autumn Shirt Blouse S","Allegra K","13.369.999.885.559.000","Women","4F4ADCBF8C6F66DCFC8A3282AC2BF10A",9
410,"6.099.320.131.671.910","Tops & Tees","Collections Etc - Tonal Sequin Tunic Top W/ Comfortable Side Slits","Samanthas Style Shoppe","10.970.000.267.028.800","Women","1068C6E4C8051CFD4E9EA8072E3189E2",6
410,"6.099.320.131.671.910","Tops & Tees","Collections Etc - Tonal Sequin Tunic Top W/ Comfortable Side Slits","Samanthas Style Shoppe","10.970.000.267.028.800","Women","1068C6E4C8051CFD4E9EA8072E3189E2",6
411,"5.784.209.847.976.410","Tops & Tees","Lilu Womens Pocket Henley Print Tee","PacSun","9.989.999.771.118.160","Women","17D63B1625C816C22647A73E1482372B",7
417,"5.089.139.820.233.580","Tops & Tees","Allegra K Ladies See Through Mesh Long Sleeve Pullover Shirt Black M","Allegra K","8.819.999.694.824.210","Women","41AE36ECB9B3EEE609D05B90C14222FB",9
417,"5.089.139.820.233.580","Tops & Tees","Allegra K Ladies See Through Mesh Long Sleeve Pullover Shirt Black M","Allegra K","8.819.999.694.824.210","Women","41AE36ECB9B3EEE609D05B90C14222FB",9
420,"6.120.399.755.901.090","Tops & Tees","Allegra K Woman Leopard Print Collar Long Sleeve Pleated Blouse Yellow S","Allegra K","114.399.995.803.833","Women","B6F0479AE87D244975439C6124592772",9
420,"6.120.399.755.901.090","Tops & Tees","Allegra K Woman Leopard Print Collar Long Sleeve Pleated Blouse Yellow S","Allegra K","114.399.995.803.833","Women","B6F0479AE87D244975439C6124592772",9
421,"2.462.276.088.931.940","Tops & Tees","Lucky Brand Women's Ikat Garden Sylvia Top","Lucky Brand","469.900.016.784.668","Women","E0C641195B27425BB056AC56F8953D24",5
432,"2.792.999.992.333.350","Tops & Tees","Panache Women's Cotton Lycra Camisole With Built In Bra","Panache","49.0","Women","248E844336797EC98478F85E7626DE4A",6
432,"2.792.999.992.333.350","Tops & Tees","Panache Women's Cotton Lycra Camisole With Built In Bra","Panache","49.0","Women","248E844336797EC98478F85E7626DE4A",6
436,"3.431.999.981.403.350","Tops & Tees","Hot Chillys Women's La Montana Panel Zip-Tee","Hot Chillys","65.0","Women","2421FCB1263B9530DF88F7F002E78EA5",3
437,"11.124.699.864.617.700","Tops & Tees","Bella Ladies' 1×1 Rib 3/4 Sleeve Raglan T-Shirt 2000","Bella","20.989.999.771.118.100","Women","FCCB60FB512D13DF5083790D64C4D5DD",4
437,"11.124.699.864.617.700","Tops & Tees","Bella Ladies' 1×1 Rib 3/4 Sleeve Raglan T-Shirt 2000","Bella","20.989.999.771.118.100","Women","FCCB60FB512D13DF5083790D64C4D5DD",4
447,"47.783.999.800.682.000","Tops & Tees","Karen Kane Women's Long Sleeve Mesh Wrap","Karen Kane","88.0","Women","9A96876E2F8F3DC4F3CF45F02C61C0C1",4
447,"47.783.999.800.682.000","Tops & Tees","Karen Kane Women's Long Sleeve Mesh Wrap","Karen Kane","88.0","Women","9A96876E2F8F3DC4F3CF45F02C61C0C1",4
454,"11.874.059.874.171.900","Tops & Tees","Moon Shine Attitude Attire Muddy Girl Camo Short Sleeve","Moon Shine Attitude Attire","19.989.999.771.118.100","Women","E44FEA3BEC53BCEA3B7513CCEF5857AC",6
463,"1.312.370.032.174.430","Tops & Tees","2B Button Front Foldover Sweater","2b by bebe","24.950.000.762.939.400","Women","428FCA9BC1921C25C5121F9DA7815CDE",5
463,"1.312.370.032.174.430","Tops & Tees","2B Button Front Foldover Sweater","2b by bebe","24.950.000.762.939.400","Women","428FCA9BC1921C25C5121F9DA7815CDE",5
470,"16.346.159.834.634.600","Tops & Tees","Port Authority Ladies Short Sleeve Value Poplin Shirt. L633","Port Authority","27.989.999.771.118.100","Women","26337353B7962F533D78C762373B3318",6
470,"16.346.159.834.634.600","Tops & Tees","Port Authority Ladies Short Sleeve Value Poplin Shirt. L633","Port Authority","27.989.999.771.118.100","Women","26337353B7962F533D78C762373B3318",6
502,"2.092.999.991.029.500","Tops & Tees","Womens Jackie New Sunrise L/S Tee","Life Is Good","35.0","Women","B5B41FAC0361D157D9673ECB926AF5AE",9
502,"2.092.999.991.029.500","Tops & Tees","Womens Jackie New Sunrise L/S Tee","Life Is Good","35.0","Women","B5B41FAC0361D157D9673ECB926AF5AE",9
506,"3.869.999.871.142.200","Tops & Tees","Ladies Seamless Tunic Cami 25 Inch Long Unstretched Multiple Colors Available","FineBrandShop","6.449.999.809.265.130","Women","FF4D5FBBAFDF976CFDC032E3BDE78DE5",7
506,"3.869.999.871.142.200","Tops & Tees","Ladies Seamless Tunic Cami 25 Inch Long Unstretched Multiple Colors Available","FineBrandShop","6.449.999.809.265.130","Women","FF4D5FBBAFDF976CFDC032E3BDE78DE5",7
512,"4.660.319.940.977.090","Tops & Tees","Allegra K Beige Self Tie Knot Stand Collar Sheer Lace Shirt for Women","Allegra K","9.119.999.885.559.080","Women","10A7CDD970FE135CF4F7BB55C0E3B59F",9
512,"4.660.319.940.977.090","Tops & Tees","Allegra K Beige Self Tie Knot Stand Collar Sheer Lace Shirt for Women","Allegra K","9.119.999.885.559.080","Women","10A7CDD970FE135CF4F7BB55C0E3B59F",9
517,"110.355.999.879.539","Tops & Tees","Trina Turk Women's Crystal Blouse","Trina Turk","188.0","Women","38913E1D6A7B94CB0F55994F679F5956",3
517,"110.355.999.879.539","Tops & Tees","Trina Turk Women's Crystal Blouse","Trina Turk","188.0","Women","38913E1D6A7B94CB0F55994F679F5956",3
524,"7.191.239.725.003.240","Tops & Tees","Allegra K Woman Stripes Print Scoop Neck Padded Shoulder Slim Tunic Shirt Black White L","Allegra K","12.229.999.542.236.300","Women","BA2FD310DCAA8781A9A652A31BAF3C68",9
524,"7.191.239.725.003.240","Tops & Tees","Allegra K Woman Stripes Print Scoop Neck Padded Shoulder Slim Tunic Shirt Black White L","Allegra K","12.229.999.542.236.300","Women","BA2FD310DCAA8781A9A652A31BAF3C68",9
532,"15.248.739.787.163.400","Tops & Tees","Port Authority Ladies Short Sleeve Cotton Pique Knit Sport Shirt Polo","Port Authority","28.989.999.771.118.100","Women","298F95E1BF9136124592C8D4825A06FC",6
535,"10.454.769.843.954.100","Tops & Tees","Moon Shine Attitude Attire Muddy Girl Camo Edge Black Short Sleeve","Moon Shine Attitude Attire","19.989.999.771.118.100","Women","33E8075E9970DE0CFEA955AFD4644BB2",6
542,"2.856.699.993.647.630","Tops & Tees","Chaus Women's 3/4 Sleeve Loop Front Diamonds Top","Chaus","49.0","Women","7DCD340D84F762EBA80AA538B0C527F7",5
542,"2.856.699.993.647.630","Tops & Tees","Chaus Women's 3/4 Sleeve Loop Front Diamonds Top","Chaus","49.0","Women","7DCD340D84F762EBA80AA538B0C527F7",5
553,"2.363.409.091.808.250","Tops & Tees","FUNFASH APPLE RED ANGEL SLEEVES TOP SHIRT BLOUSE CLOTHING Plus Size Made in USA","Funfash","399.900.016.784.668","Women","F387624DF552CEA2F369918C5E1E12BC",1
553,"2.363.409.091.808.250","Tops & Tees","FUNFASH APPLE RED ANGEL SLEEVES TOP SHIRT BLOUSE CLOTHING Plus Size Made in USA","Funfash","399.900.016.784.668","Women","F387624DF552CEA2F369918C5E1E12BC",1
557,"47.931.800.579.202.100","Tops & Tees","Allegra K Women 3/4 Sleeves Self Tie Front Falbala Blouse Pink XS","Allegra K","9.380.000.114.440.910","Women","6E2713A6EFEE97BACB63E52C54F0ADA0",9
557,"47.931.800.579.202.100","Tops & Tees","Allegra K Women 3/4 Sleeves Self Tie Front Falbala Blouse Pink XS","Allegra K","9.380.000.114.440.910","Women","6E2713A6EFEE97BACB63E52C54F0ADA0",9
564,"2.070.999.996.177.850","Tops & Tees","Armani Exchange Statement Stagger Logo tee","A:X Armani Exchange","38.0","Women","1728EFBDA81692282BA642AAFD57BE3A",8
571,"2.834.999.991.953.370","Tops & Tees","Red Dot Women's Deep V Neck Top","Red Dot","54.0","Women","C9892A989183DE32E976C6F04E700201",8
595,"29.996.999.938.040.900","Tops & Tees","Lucky Brand Women's Under The Stars Thermal Shirt","Lucky Brand","49.5","Women","04ECB1FA28506CCB6F72B12C0245DDBC",5
595,"29.996.999.938.040.900","Tops & Tees","Lucky Brand Women's Under The Stars Thermal Shirt","Lucky Brand","49.5","Women","04ECB1FA28506CCB6F72B12C0245DDBC",5
597,"1.236.899.995.431.300","Tops & Tees","Selena Gomez When The Sun Goes Down Black Tissue T-Shirt","Selena Gomez","21.0","Women","08C5433A60135C32E34F46A71175850C",9
597,"1.236.899.995.431.300","Tops & Tees","Selena Gomez When The Sun Goes Down Black Tissue T-Shirt","Selena Gomez","21.0","Women","08C5433A60135C32E34F46A71175850C",9
627,"4.727.919.963.614.940","Tops & Tees","Allegra K Woman Roll up Short Sleeve Point Collar Stripe Shirt Multicolor S","Allegra K","9.039.999.961.853.020","Women","185C29DC24325934EE377CFDA20E414C",9
661,"9.131.700.153.964.750","Tops & Tees","Collections Etc - Lorraine Low Cut Paisley Tunic","Samanthas Style Shoppe","14.970.000.267.028.800","Women","3A066BDA8C96B9478BB0512F0A43028C",6
661,"9.131.700.153.964.750","Tops & Tees","Collections Etc - Lorraine Low Cut Paisley Tunic","Samanthas Style Shoppe","14.970.000.267.028.800","Women","3A066BDA8C96B9478BB0512F0A43028C",6
662,"4.230.789.852.081.830","Tops & Tees","Allegra K Woman Faux Crystal Detail Leopard Print Strapped Tank Top M","Allegra K","696.999.979.019.165","Women","BE3159AD04564BFB90DB9E32851EBF9C",9
663,"15.024.999.994.784.500","Tops & Tees","FEA Juniors Hunger Games Book Tribute Spray Tissue Tee","FEA","25.0","Women","8757150DECBD89B0F5442CA3DB4D0E0E",6
663,"15.024.999.994.784.500","Tops & Tees","FEA Juniors Hunger Games Book Tribute Spray Tissue Tee","FEA","25.0","Women","8757150DECBD89B0F5442CA3DB4D0E0E",6
667,"18.639.689.265.636.200","Tops & Tees","French Connection Women's Summer Silk Shirt","French Connection","32.529.998.779.296.800","Women","B5DC4E5D9B495D0196F61D45B26EF33E",5
668,"15.574.000.383.339.800","Tops & Tees","2B Sequin Stripe Sweater","2b by bebe","29.950.000.762.939.400","Women","192FC044E74DFFEA144F9AC5DC9F3395",5
668,"15.574.000.383.339.800","Tops & Tees","2B Sequin Stripe Sweater","2b by bebe","29.950.000.762.939.400","Women","192FC044E74DFFEA144F9AC5DC9F3395",5
681,"6.274.840.139.172.820","Tops & Tees","Collections Etc - Rose Applique & Pearl Beaded Top","Samanthas Style Shoppe","10.970.000.267.028.800","Women","1595AF6435015C77A7149E92A551338E",6
681,"6.274.840.139.172.820","Tops & Tees","Collections Etc - Rose Applique & Pearl Beaded Top","Samanthas Style Shoppe","10.970.000.267.028.800","Women","1595AF6435015C77A7149E92A551338E",6
686,"8.098.770.133.532.130","Tops & Tees","Collections Etc - Sweetheart Neckline Lace Trim Short Sleeve Top","Samanthas Style Shoppe","14.970.000.267.028.800","Women","109A0CA3BC27F3E96597370D5C8CF03D",6
695,"31.991.999.931.633.400","Tops & Tees","Hard Tail Long Skinny Tee","Hard Tail","62.0","Women","E4BB4C5173C2CE17FD8FCD40041C068F",10
701,"21.735.999.953.001.700","Tops & Tees","American Apparel Leaf Flower Lace Tee","American Apparel","38.0","Women","B4A528955B84F584974E92D025A75D1F",8
724,"2.296.853.085.054.570","Tops & Tees","Blue Banana - Figure Hugging Halter Neck Top","Blue Banana","419.900.016.784.668","Women","7F1171A78CE0780A2142A6EB7BC4F3C8",3
724,"2.296.853.085.054.570","Tops & Tees","Blue Banana - Figure Hugging Halter Neck Top","Blue Banana","419.900.016.784.668","Women","7F1171A78CE0780A2142A6EB7BC4F3C8",3
725,"13.649.999.955.669.000","Tops & Tees","Southpole Junior's Basic Solid Color V-Neck Tee","Southpole","25.0","Women","82F2B308C3B01637C607CE05F52A2FED",1
735,"8.999.999.966.472.380","Tops & Tees","YogaColors Crystal Tri Blend T Back Tank Top Up To Size 4XL","YogaColors","15.0","Women","6CD67D9B6F0150C77BDA2EDA01AE484C",2
735,"8.999.999.966.472.380","Tops & Tees","YogaColors Crystal Tri Blend T Back Tank Top Up To Size 4XL","YogaColors","15.0","Women","6CD67D9B6F0150C77BDA2EDA01AE484C",2
783,"4.875.499.983.690.670","Sweaters","Calvin Klein Women's MSY Flyaway Sweater","Calvin Klein","99.5","Women","6E0721B2C6977135B916EF286BCB49EC",3
796,"13.494.599.854.061.000","Tops & Tees","O'Neill Juniors Michi Tube Top","O'Neill","24.989.999.771.118.100","Women","35CF8659CFCB13224CBD47863A34FC58",8
796,"13.494.599.854.061.000","Tops & Tees","O'Neill Juniors Michi Tube Top","O'Neill","24.989.999.771.118.100","Women","35CF8659CFCB13224CBD47863A34FC58",8
806,"41.799.999.967.217.400","Sweaters","Leo & Nicole Women's Long Notch Collar with Fringe Cardigan","Leo & Nicole","88.0","Women","D58072BE2820E8682C0A27C0518E805E",1
807,"4.125.949.992.798.260","Sweaters","Isaac Mizrahi Women's Felicity Sweater","Isaac Mizrahi Jeans","89.5","Women","6E7B33FDEA3ADC80EBD648FFFB665BB8",2
807,"4.125.949.992.798.260","Sweaters","Isaac Mizrahi Women's Felicity Sweater","Isaac Mizrahi Jeans","89.5","Women","6E7B33FDEA3ADC80EBD648FFFB665BB8",2
812,"6.159.729.806.397.550","Sweaters","Black Cotton Blend Skull Skeleton Punk Long Sleeve Knitted Cardigan Sweater Tops","Xfy","131.899.995.803.833","Women","81E74D678581A3BB7A720B019F4F1A93",5
812,"6.159.729.806.397.550","Sweaters","Black Cotton Blend Skull Skeleton Punk Long Sleeve Knitted Cardigan Sweater Tops","Xfy","131.899.995.803.833","Women","81E74D678581A3BB7A720B019F4F1A93",5
815,"14.002.169.862.667.000","Sweaters","US Polo Assn. Juniors Solid V-Neck Sweater","U.S. Polo Assn.","28.989.999.771.118.100","Women","71AD16AD2C4D81F348082FF6C4B20768",7
815,"14.002.169.862.667.000","Sweaters","US Polo Assn. Juniors Solid V-Neck Sweater","U.S. Polo Assn.","28.989.999.771.118.100","Women","71AD16AD2C4D81F348082FF6C4B20768",7
825,"393.124.998.966.232","Sweaters","Christopher Fischer Women's 100% Cashmere V-Neck  Button Cuff Detail Sweater","Christopher Fischer","92.5","Women","D554F7BB7BE44A7267068A7DF88DDD20",2
825,"393.124.998.966.232","Sweaters","Christopher Fischer Women's 100% Cashmere V-Neck  Button Cuff Detail Sweater","Christopher Fischer","92.5","Women","D554F7BB7BE44A7267068A7DF88DDD20",2
836,"48.184.999.972.581.800","Sweaters","Christopher Fischer Women's 100% Cashmere Solid Featherweight Hoodie","Christopher Fischer","115.0","Women","AB88B15733F543179858600245108DD8",2
836,"48.184.999.972.581.800","Sweaters","Christopher Fischer Women's 100% Cashmere Solid Featherweight Hoodie","Christopher Fischer","115.0","Women","AB88B15733F543179858600245108DD8",2
845,"22.147.999.968.146.900","Sweaters","Huafeng Fawn Colored Stripe Loose Xmas Sweaters Womens","Huafeng","49.0","Women","B86E8D03FE992D1B0E19656875EE557C",6
845,"22.147.999.968.146.900","Sweaters","Huafeng Fawn Colored Stripe Loose Xmas Sweaters Womens","Huafeng","49.0","Women","B86E8D03FE992D1B0E19656875EE557C",6
890,"3.847.199.996.933.340","Sweaters","Carve Designs Women's Sunday Sweater","Carve Designs","84.0","Women","024D7F84FFF11DD7E8D9C510137A2381",6
890,"3.847.199.996.933.340","Sweaters","Carve Designs Women's Sunday Sweater","Carve Designs","84.0","Women","024D7F84FFF11DD7E8D9C510137A2381",6
895,"7.474.499.988.136.810","Sweaters","Curve Appeal Dolman 3/4 Sleeve Cable Weave Knit Sweater","Curve Appeal","45.428","Women","20AEE3A5F4643755A79EE5F6A73050AC",8
897,"39.774.999.972.432.800","Sweaters","Christopher Fischer Women's 100% Cashmere Solid Raglan Crew Neck Sweater","Christopher Fischer","92.5","Women","5705E1164A8394AACE6018E27D20D237",2
910,"7.584.299.999.289.210","Sweaters","Women's Cashmere Cardigan Twin Sweater Set","Cashmere Boutique","159.0","Women","E205EE2A5DE471A70C1FD1B46033A75F",1
910,"7.584.299.999.289.210","Sweaters","Women's Cashmere Cardigan Twin Sweater Set","Cashmere Boutique","159.0","Women","E205EE2A5DE471A70C1FD1B46033A75F",1
918,"361.397.989.754.051","Sweaters","Beautiful Knitting Weaveing Women Lady Cardigan Sweater Long Sleeve Candy Colors","Xfy","8.989.999.771.118.160","Women","1E056D2B0EBD5C878C550DA6AC5D3724",5
918,"361.397.989.754.051","Sweaters","Beautiful Knitting Weaveing Women Lady Cardigan Sweater Long Sleeve Candy Colors","Xfy","8.989.999.771.118.160","Women","1E056D2B0EBD5C878C550DA6AC5D3724",5
923,"27.430.350.716.758.100","Sweaters","Ed Garments Women's Corporate Performance Crewneck Cardigan. 038","Ed Garments","589.900.016.784.668","Women","C4015B7F368E6B4871809F49DEBE0579",7
923,"27.430.350.716.758.100","Sweaters","Ed Garments Women's Corporate Performance Crewneck Cardigan. 038","Ed Garments","589.900.016.784.668","Women","C4015B7F368E6B4871809F49DEBE0579",7
939,"2.251.599.991.321.560","Sweaters","Sofie Women's 100% Cashmere Crew-Neck Tee","Sofie","52.0","Women","3DF1D4B96D8976FF5986393E8767F5B2",2
941,"14.515.159.922.290.700","Sweaters","Plus size Cropped Ruffled Shawl Shrug Bolero Black","eVogues Apparel","29.989.999.771.118.100","Women","92262BF907AF914B95A0FC33C3F33BF6",5
