"id","cost","category","name","brand","retail_price","department","sku","distribution_center_id"
21057,"25.640.999.961.644.400","Jeans","Bullhead Mens Drakes Skinniest Immense Indigo Jeans","Bullhead","49.5","Men","46E6D0F07B047818EDF84360ACD315C7",10
21080,"24.609.530.929.518.100","Jeans","RIGGS WORKWEAR by Wrangler Men's Big and Tall Work Horse Jean","Wrangler","449.900.016.784.668","Men","96B6715EDB4B085B70F0CFF47D43A1ED",7
21081,"3.930.695.882.920.630","Jeans","Lucky Brand Mens Men's 367 Classic Vintage Low Rise Boot Leg Jean","Lucky Brand","7.798.999.786.376.950","Men","F097E1436435F978E0B8F404C8B848D3",5
21088,"10.905.299.956.910.300","Jeans","Joe's Jeans Men's Big-Tall Inseam Athlete Fit","Joe's Jeans","189.0","Men","B9CF16C6BC32C1F73BD7A762C6DC43E0",6
21102,"480.599.999.204.278","Jeans","GUESS Desmond Jeans in Night Vision Wash 30 I","GUESS","89.0","Men","531A192EF56B0C958AE831A8C40898BB",7
21111,"9.136.799.991.875.880","Jeans","AG Adriano Goldschmied Men's Matchbox Slim Tonal Stitch Straight Jean","AG Adriano Goldschmied","188.0","Men","71ECF3A12729BA438D057DF53C82A1CA",4
21135,"2.340.799.997.467.540","Jeans","Nautica Jeans Company Mens Classic Fit Jeans Faded Medium Wash","Nautica","44.0","Men","87191796A64E570BC2CE6F722D7F8277",8
21143,"7.076.440.147.349.080","Jeans","Joe's Jeans Men's Colored Brixton Jean","Joe's Jeans","1.393.000.030.517.570","Men","1986405E39C5A79665AF1746738C1F46",6
21154,"16.254.579.858.964.300","Jeans","ENYCE Men's Whiskey Jean","Enyce","29.989.999.771.118.100","Men","1C510BCFC31CC54E674C2A53CE0989D5",5
21176,"361.759.999.608.621","Jeans","Volcom Men's Nova Modern Straight Leg Fit","Volcom","68.0","Men","D3771DBDA05117C970B350DA0021662C",4
21178,"39.267.499.963.752.900","Jeans","Calvin Klein Jeans Men's Rocker Slim Straight Leg Jean","Calvin Klein Jeans","69.5","Men","6BABC4F58D8D2E929D85FC2175025C92",8
21188,"3.905.900.005.903.090","Jeans","Kenneth Cole New York Men's Dark Indigo Jean","Kenneth Cole New York","69.5","Men","133A2EC99E2817A4327621DF3F856CA2",1
21204,"6.844.799.965.247.510","Jeans","Rock Revival Mens Victor Jean","Rock Revival","138.0","Men","3BD80CC75F3BEE69358296A3C4D8F01E",10
21211,"12.036.220.304.614.600","Jeans","Diesel Jean Mennit 73N","Diesel","2.086.000.061.035.150","Men","A25AE004EADF95406855FFBAD5653993",10
21221,"4.095.487.891.459.360","Jeans","Cinch Western Denim Jeans Mens Carter Relaxed Dk Wash MB96134002","Cinch","7.998.999.786.376.950","Men","1B8058DEE2800A7E966DCB494A5F1FED",3
21231,"1.913.820.002.637.800","Jeans","True Religion Men's Ricky Super-T Straight Jean","True Religion","334.0","Men","8012C113F03996CD9A5511BAA835B83E",7
21241,"55.663.999.814.540.100","Jeans","Mavi Men's Matt Jean","Mavi","98.0","Men","4AC61D3ECE467A154921BE8EB908680D",6
21248,"8.771.099.989.674.980","Jeans","7 For All Mankind Men's Slimmy Slim Straight Leg Twill Jean","7 For All Mankind","169.0","Men","B8719842648C05533160CB28DE3DF4AA",8
21250,"33.954.340.816.818.000","Jeans","Cinch Mens Jeans MB90633001IND","Cinch","599.900.016.784.668","Men","F3E473999B625855BDF3F6A75F7B8F3A",3
21257,"24.155.999.994.836.700","Jeans","G by GUESS Calan Straight Jeans - Rinse Wash - 32 I","G by GUESS","49.5","Men","146E984733B19BF173F9E7552ECD933B",3
21260,"19.494.699.985.161.400","Jeans","True Religion Men's Bobby Super Jean","True Religion","383.0","Men","3F2624BA9FFC5EBD40C98284E1379E99",7
21275,"23.300.580.885.386.100","Jeans","Cinch Bronze Label Dark Stonewash Slim Fit Jeans","CINCH","429.900.016.784.668","Men","EB373961A9E663F29108E296D307BCB8",5
21285,"3.440.249.994.304.030","Jeans","Quiksilver Revolver Denim Pant - Men's","Quiksilver","69.5","Men","BF9B5A850F9AFD054EB3BCD288C246C9",9
21291,"23.303.700.350.067.700","Jeans","Wrangler Men's Premium Performance Cowboy Cut Jean","Wrangler","47.950.000.762.939.400","Men","8F0CA6A7AFDA126DF10BEDB633192388",7
21300,"7.279.909.820.417.830","Jeans","Rock Revival - Mens Tony Straight Leg Jeans in T Denim","Rock Revival","1.259.499.969.482.420","Men","9D88196D9B43925EC4093E0228FD7803",10
21308,"3.018.656.089.985.600","Jeans","Liberty Blues Big & Tall Wide Leg Comfort Waist Jeans","Liberty","554.900.016.784.668","Men","432FF29E76B94B98CFF04B435F5C89F2",8
21324,"3.057.999.909.862.870","Jeans","Perry Ellis Men's Reactive Dye Slim Fit Denim","Perry Ellis","5.559.999.847.412.100","Men","4537A9E98E90F416DADAEDD65C416843",6
21327,"2.360.151.086.638.650","Jeans","Levi's 505 Men's Straight Fit Jean - Standardize","Levi's","429.900.016.784.668","Men","250AA0985D9E292B68C8841C3C95AA10",4
21331,"6.824.999.994.132.660","Jeans","EARNEST SEWN DENIM Men's Fulton Rigid Selvedge Jean","Earnest Sewn","131.25","Men","7815A62BC723A1C2884807EEFD6640C5",1
21336,"4.603.049.984.481.180","Jeans","Marc Ecko Cut & Sew Men's Twisted Wash Jean","Marc Ecko Cut & Sew","79.5","Men","FBFDAB7E3983009E7D488D946A8DE066",1
21340,"9.859.999.977.052.210","Jeans","Diesel Men's Thavar Skinny-Fit Straight-Leg Jean","Diesel","200.0","Men","296ADD4760393DC63707E407AFFCBC84",10
21355,"6.806.799.985.282.120","Jeans","Buffalo by David Bitton Men's Driven Straight Leg Rubbed And Worked Jean","Buffalo by David Bitton","119.0","Men","23755D10E2FE7C7A11342F80352A8E9D",3
21364,"28.797.999.954.782.400","Jeans","Marc Ecko Cut & Sew Men's Baked Alaska Bootcut Fit Jean","Marc Ecko Cut & Sew","59.5","Men","6B387EBBCB8020CE186644D4A4669C6A",1
21378,"15.674.999.956.972.800","Jeans","Generra Men's Slim Straight Native Jean","Generra","45.439","Men","47AAD7688350FBFD9A9109E8EE88F0F4",7
21382,"3.296.299.997.251.480","Jeans","Hurley Juniors 81 Skinny Legging","Hurley","59.5","Men","A4567880C61CB00693665491B5C356A3",1
21383,"32.295.449.220.481.500","Jeans","Silver Jeans Men's Gordie Straight Leg Jean","Silver Jeans","5.818.999.862.670.890","Men","C11F285561275C64ED465F50580089AC",1
21422,"7.120.799.984.782.930","Jeans","Joe's Jeans Men's Classic Benny Straight Leg Jean","Joe's Jeans","138.0","Men","02F83D35779D1914212CAE6784E70D18",6
21427,"8.614.056.200.102.200","Jeans","Hudson Men's Byron 5 Packet Selvage Straight Leg Jean","Hudson","1.768.800.048.828.120","Men","141FDED8387B387998EEEDD6820F3EE3",2
21430,"4.354.800.006.002.180","Jeans","LRG The Smokey Ridge TS Jeans in Raw Indigo","LRG","76.0","Men","FEAFB280B99F47D2E75D6008F73C15A3",2
21434,"10.205.999.983.102.000","Jeans","Joe's Jeans Men's Straight Leg Classic Fit","Joe's Jeans","189.0","Men","9DA23AB27B8170050F4F24548C3C5AC4",6
21435,"19.308.499.973.791.100","Jeans","RUDE White Skinny Fit Denim Jeans","Hot Topic","36.5","Men","C008C31802EC4B9C2126914D5D41ED9F",10
21457,"31.074.999.971.315.200","Jeans","Wrangler Men's 20x Collection Jean","Wrangler","55.0","Men","A6A141F631618325C81115ED35C32FF5",7
21468,"812.356.965.328.187","Jeans","Affliction - Mens Black Premium Blake Cathdrl Flare Flap Crossroads Jeans In Crossroads Wash","Affliction","14.689.999.389.648.400","Men","D196F1CDF8A30B4002133F8CA0FA5BA5",9
21479,"1.711.199.991.311.870","Jeans","RUDE Blue Black Super Skinny Fit Denim Jeans","Hot Topic","34.5","Men","331D52C912E4221B962FAFAED868E6A4",10
21487,"21.290.499.958.209.600","Jeans","RUDE Black Destroyed Super Skinny Fit Denim Jeans","Hot Topic","39.5","Men","743A3892F8CED95E1FAB16FC98A9F3E3",10
21507,"15.868.190.827.497.600","Jeans","Key Industries Men's Relaxed Fit Indigo Denim Double Front Logger Dungaree","Key Industries","329.900.016.784.668","Men","F785D67F490E60AAA9E63D821B6440D4",2
21511,"7.494.999.885.559.080","Jeans","Mens Relaxed Fit Tapered Slightly Black Denim Jeans","LabelShopper","14.989.999.771.118.100","Men","F37CF9EA93740F0BD3177789C2B244E4",6
21512,"7.398.399.996.757.500","Jeans","GUESS Lincoln Jeans in CRX wash 32 Inseam","GUESS","128.0","Men","A0BC671C2BBE978C889AB37F2C4B72B1",7
21513,"24.452.800.404.322.100","Jeans","Lip Service Mens Rocker Vintage Wash Stretch Denim Jeans","Lip Service","44.950.000.762.939.400","Men","0628578027F2F3E17ABF142C0FAEC461",1
21545,"10.981.999.995.186.900","Jeans","Joe's Jeans Men's Brixton Straight and Narrow Denim in Bradley","Joe's Jeans","190.0","Men","4A44A230105CCDBCC59C27720A7982DA",6
21554,"4.580.490.887.779.380","Jeans","New 575 Denim Men's Jeans Dark Wash Relaxed Straight Leg M3NY01DRK-GNNVY","575 Denim","8.998.999.786.376.950","Men","D8696CC3E3447AC44237A936A80B05D8",2
21558,"3.461.423.083.170.540","Jeans","Petrol Jeans - Macha","Petrol Jeans","599.900.016.784.668","Men","3FC19681D9D74F31286A182D200B9E7F",2
21565,"47.525.999.957.229.900","Jeans","Laguna Beach Jean Company Men's BBB Straight Leg Hermosa Beach Denim","Laguna Beach Jean Company","89.0","Men","CAE582C97681E4F465420FADB30E84A4",2
21572,"47.011.999.994.516.300","Jeans","Silver Jeans Men's Zac Relaxed Fit Jean","Silver Jeans","92.0","Men","08D24D640DDB54AD66F3562185BC0F49",1
21577,"13.369.649.857.998.200","Jeans","Men's 34 inch Inseam Red Kap Loose Fit Denim Jeans","Red Kap","24.989.999.771.118.100","Men","0174A6D48B2B6C3D8C1928C759583F40",6
21595,"10.863.999.944.925.300","Jeans","True Religion Men's Bobby Snake Eyes Straight Jean","True Religion","224.0","Men","F64BE92FC42691C03917865D7C8CEB96",7
21597,"31.360.000.014.305.100","Jeans","KR3W Klassic Jeans - Dark Blue","KR3W","64.0","Men","087EE12282D24D81482DE8BE77D6FBAD",7
21600,"6.198.695.877.489.160","Jeans","7 For All Mankind Men's Standard Classic Straight Leg Jean In Cloudy Summer","7 For All Mankind","12.298.999.786.376.900","Men","C8AAE6E64A66C6505372D132360F72C2",8
21614,"5.770.199.978.724.120","Jeans","Mavi Men's Zach Low Rise Jean","Mavi","118.0","Men","4717C244331EB475A42E5F58945E945C",6
21651,"35.647.148.357.512.800","Jeans","Omit Stix Slim Denim Pant - Men's","Omit","6.894.999.694.824.210","Men","09DBCC085B7640B12B75DEB6C16D2A14",4
21663,"21.909.319.380.194.200","Pants","Carhartt Men's Washed Twill Relaxed Fit Dungaree","Carhartt","5.118.999.862.670.890","Men","FB4032C5962CEA1E0365D6E49FE381C4",3
21670,"17.755.200.822.199.800","Pants","Haggar Men's Work To Weekend 14 Wale Corduroy Plain Front Expandable Waistband Pant","Haggar","369.900.016.784.668","Men","FBDBFDA408198BBFBAE637420759F90C",6
21672,"2.934.000.000.357.620","Pants","Haggar Men's Work To Weekend Expandable Waist Flat Front Twill Pant","Haggar","60.0","Men","DAA172021EB0B28D756615925486F129",6
21673,"22.600.000.025.704.500","Pants","Dockers Men's Easy D3 Classic Fit Pleated Khaki Pant","Dockers","50.0","Men","8D421E49D5885B59C7AEC69404514E3D",7
21680,"23.100.000.098.347.600","Pants","Dockers Men's Soft Khaki D3 Classic Fit Flat Front Pant","Dockers","55.0","Men","B709742D89F8D9A642A31ABD93DFD49D",7
21681,"186.429.608.701.998","Pants","Dockers  Men's Comfort Khaki D4 Relaxed Fit Flat Front Pant","Dockers","369.900.016.784.668","Men","87269806E37B9FE07A7C7AED9AD6F986",7
21689,"3.340.800.007.805.220","Pants","Dockers Men's Iron Free Khaki D2 Straight Fit Flat Front Pant","Dockers","72.0","Men","E4628797D1C5B2D9E119F892F43F3D6D",7
21691,"224.950.008.392.334","Pants","Dockers Mens New Iron Free Khaki D3 Classic Fit Pleated Pant","Dockers","449.900.016.784.668","Men","006B9646DCBA176709EB7A322E61E2B7",7
21704,"30.615.000.054.240.200","Pants","Haggar Mens Cool 18 Gabardine Pleat Front Pant","Haggar","65.0","Men","93960D5FB44E9016051AAC44FB34F9F6",6
21706,"4.031.369.863.550.660","Pants","Mountain Khakis Men's Teton Twill Pant","Mountain Khakis","8.294.999.694.824.210","Men","AA00165FED22ACF7B3370D43AB14A4AA",3
21721,"4.499.549.915.044.380","Pants","Tommy Hilfiger Men's Flat Front Trim Fit 100% Wool Suit Separate Pant","Tommy Hilfiger","9.998.999.786.376.950","Men","68BCCF167BD2BF274A20BFEB84AC291D",1
21722,"28.016.000.032.424.900","Pants","Dockers Men's Flannel Lined Ultimate Khaki D2 Flat Front Pant","Dockers","68.0","Men","8C0592C2F4067CF98DC39A5F0734105D",7
21724,"2.463.693.988.506.250","Pants","Savane Men's Pleated No-Iron Twill Pant","Savane","4.897.999.954.223.630","Men","CE86348064F870F0F4A4F72D42413062",4
21736,"19.795.600.798.861.600","Pants","Kenneth Cole REACTION Men's Smooth Sailing Modern Flat-Front Dress Pant","Kenneth Cole REACTION","449.900.016.784.668","Men","BCAAD45DCF4AD3E57D8F1C22266C69C8",1
21756,"11.825.000.029.057.200","Pants","Lee Men's Utility Pant","Lee","25.0","Men","8AD4C739093F61FA17107D24DDBB4492",5
21764,"2.311.650.005.495.170","Pants","Nautica Men's True Khaki Pleated Front Cuffed Pant","Nautica","49.5","Men","1B3BD97E8225BA7472E75231438C3603",8
21808,"39.218.198.731.090.100","Pants","Mountain Khakis Men's Lake Lodge Twill Pant","Mountain Khakis","8.994.999.694.824.210","Men","CFDEEFC98127480B07BD11D089E62BF2",3
21815,"24.895.020.819.488.400","Pants","Louis Raphael ROSSO Men's Washable Wool-Blend Flat-Front Dress Pant","Louis Raphael","499.900.016.784.668","Men","618D8CB4EAE98F783B4285E692E91D38",5
21820,"2.568.800.014.257.430","Pants","DC Men's DC Worker Straight Non-Denim Pant","DC","52.0","Men","00509E33150CBA19D677C83AD03FEBAE",4
21822,"17.291.399.665.108.300","Pants","Dickies WP810 Men's Slim Skinny Fit 5-Pocket Pant","Dickies","3.579.999.923.706.050","Men","D39D59C114B33BB5E40238A65A2EC09B",1
21831,"3.022.034.905.749.520","Pants","Kenneth Cole Reaction Men's Black Solid Suit Separate Pant","Kenneth Cole REACTION","6.498.999.786.376.950","Men","7AC0D6F2A7E643934C4C056762C37596",1
21836,"6.325.000.012.293.450","Pants","Bill's Khakis Original Twill Pants - M2 Style","Bill's Khakis","125.0","Men","14663816A87FF1539E548004E8C4C7BE",4
21840,"14.565.840.472.195.100","Pants","Wrangler Rugged Wear Men's Relaxed Fit Casual Pant with Teflon Coating Khaki","Wrangler","32.880.001.068.115.200","Men","2BBD84C0A50AEDC1DF983F360EFD12D0",7
21847,"6.016.000.008.583.060","Pants","Armani Exchange Soho Dress Pant","A:X Armani Exchange","128.0","Men","D140B46B9030BD231B950B3E6CF02EE4",8
21851,"309.075.190.974.544","Pants","Creekwood« Big Mens Full Elastic-Waist Twill Pants (Big & Tall and Regular Sizes)","Bigmansland","6.898.999.786.376.950","Men","FE39765E51D6DADB4EDDBA0DFE604086",1
21854,"2.836.200.000.345.700","Pants","Toddland Men's Greatest Pant","Toddland","58.0","Men","BD62968254ECA150BDE010B72E3AA9C0",6
21855,"27.694.800.420.549.500","Pants","Eddie Bauer Classic Fit Legend Wash Chino Pants","Eddie Bauer","54.950.000.762.939.400","Men","C1CDF86F74B3F0C805AA4895397F1400",2
21881,"47.806.000.135.838.900","Pants","Joseph Abboud Men's Flat Front Dress Pant","Joseph Abboud","106.0","Men","CE5B54471D6429E7414522CEB08291A7",5
21891,"1.774.499.997.496.600","Pants","Dockers Men's Stain Defender Khaki D2 Straight Fit Flat Front Pant","Dockers","35.0","Men","598E989A5706E1AB5CEA5E65598D2125",7
21906,"241.951.608.675.012","Pants","Kenneth Cole Reaction Mens Navy Stripe Suit Separate Pant","Kenneth Cole REACTION","499.900.016.784.668","Men","78DBE27FDB74C9AE3B0A6C17BFFA8B18",1
21907,"1.947.513.088.117.430","Pants","IZOD Men's Saltwater 5-Pocket Straight Fit Corduroy Pant","IZOD","399.900.016.784.668","Men","E1114C80B1403391C2DCA875F2CC1310",4
21914,"25.056.000.058.539.200","Pants","Timberland Men's Straight Fit Chino Pants","Timberland","54.0","Men","D84F9EBCCF1B062F6DCE85D56FE09420",7
21931,"2.975.504.079.318.700","Pants","Dockers Men's Big-Tall Iron Free D3 Classic Fit Pleated Pant","Dockers","599.900.016.784.668","Men","0FCE7805546CF456C1D9E8B443E770F9",7
21954,"13.015.659.911.390.500","Pants","Southpole Men's Belted Cargo Pant","Southpole","29.989.999.771.118.100","Men","72FB5A1BBD1CDA5A11251BA1D220672E",1
21956,"1.067.500.002.682.200","Pants","Haggar Men's Mitchell Pleat Front Rigid Waist Casual Pant","Haggar","25.0","Men","D91F7910CD3924264D0A7732A94A624B",6
21977,"13.850.900.645.336.500","Pants","Lee Men's Custom Fit Flat Front Pant","Lee","32.900.001.525.878.900","Men","DB2D1BC7F17A3A44B4F1CB9075F6899C",5
21988,"24.330.930.816.657.500","Pants","Tru-Spec 100% Cotton 24-7 Series Pants","Tru-Spec","479.900.016.784.668","Men","FE4E2A8A9740BC9311616FC08781FCF9",2
21992,"2.463.300.004.787.740","Pants","Perry Ellis Men's Premium Twill No Iron Double Pleat Modern Fit Pant","Perry Ellis","59.5","Men","71541653EDFD81EE0AE62FB1FD1BE011",6
21993,"22.595.640.517.674.900","Pants","Wrangler Men's Ranger Pant","Wrangler","49.880.001.068.115.200","Men","CDA6EEA50E92E0D0B6D22B6B54364FF0",7
22015,"22.572.000.034.851.900","Pants","Bullhead Mens Gravels Slim Fit Twill Pants","Bullhead","49.5","Men","AE7EC2B45BEED17D0786E97D65A39E8D",10
22016,"22.395.520.791.433.300","Pants","Dockers Men's Limited Offer Big & Tall D2 Straight Fit Khaki Pant","Dockers","499.900.016.784.668","Men","FD22A77FFD3CC179B3C1407D6EA0637B",7
22019,"2.635.849.999.822.670","Pants","Perry Ellis Men's Premium Twill No Iron Flat Front Modern Fit Pant","Perry Ellis","59.5","Men","BCBE273F4A8B880191C91C0B27CC66DF",6
22022,"15.244.550.376.732.600","Pants","Concitor Men's Red Pants Linen Cotton Flat Front Slacks","Concitor","29.950.000.762.939.400","Men","E7E4F740F97A38C313A9ABC2EC6AB85E",2
22024,"34.75","Pants","Kenneth Cole Men's Five Pocket Pant","Kenneth Cole","69.5","Men","D5CC7743B1AF1094B27AFD0CCCD8FAEE",6
22026,"1.631.259.079.587.440","Pants","Ben Davis Work Pants","Ben Davis","369.900.016.784.668","Men","2BEC3F7F8208E144C8FA1484D642EB47",3
22042,"1.819.908.091.509.900","Pants","Haggar Men's Life Khaki Slim Fit Flat Front Chino Casual Pant","Haggar","369.900.016.784.668","Men","D2EE7C802D33276B97B3298931E82303",6
22048,"37.928.000.152.111.000","Pants","Armani Exchange Relaxed Logo Pant","A:X Armani Exchange","88.0","Men","2BEE829BED9516889344BB4A675D7E38",8
22049,"2.159.520.082.577.610","Pants","Kenneth Cole Reaction Men's Tonal Herringbone Dress Pant","Kenneth Cole REACTION","449.900.016.784.668","Men","72D77C3011A916A4403E8342C57C6782",1
22054,"5.830.800.006.631.760","Pants","Original ratcatcher Moleskin Pants / Plain Lovat","Orvis","129.0","Men","E3F8CEDCE7F1FA45B35CECCFDCB7249F",8
22083,"13.789.209.681.489.400","Pants","Dickies Men's Young Adult Sized Pleated Front Pant","Dickies","2.796.999.931.335.440","Men","771F0D31D334435279EA1EA02B2C660C",1
22087,"1.392.675.037.819.700","Pants","Concitor Men's Dress Pants Slacks Flat Front Trousers Yellow","Concitor","29.950.000.762.939.400","Men","0E1DDC294FDE5896865DD30B1912C8A0",2
22089,"23.641.000.110.656.000","Pants","Wolverine Men's Mechanic Pant","Wolverine","47.0","Men","06C35F4DA8A8D973FE3C611EC1FB7B49",1
22096,"17.422.290.821.424.700","Pants","Men's Rubberized Waistband Tuxedo Pant","Ed Garments","369.900.016.784.668","Men","61B80B3C2E4D6C208F2C634AE5816887",7
22104,"7.197.599.860.218.910","Pants","Spyder Router Insulated Ski Pant Mens","Spyder","1.499.499.969.482.420","Men","8325DBC7AC91F99506509CE372CACE0F",4
22113,"1.795.472.064.344.460","Pants","Haggar Men's Herringbone Pleat Front Cuff Suit Separate Pant","Haggar","37.720.001.220.703.100","Men","6746201227327C1C921895265C1C58D2",6
22115,"12.579.000.373.989.300","Pants","Concitor Men's Dress Pants Slacks Flat Front Trousers Emerald Green","Concitor","29.950.000.762.939.400","Men","A9836BA478550A1E6FFE8A013A8A0A4B",2
22120,"5.525.000.020.861.620","Pants","Bill's Khakis Original Twill Pants - M3 Style","Bill's Khakis","125.0","Men","FD03F6198800B312694493F5BBD9407A",4
22139,"1.759.421.977.829.810","Pants","Royal Bones Plaid Overdye Super Skinny Pants","Hot Topic","3.597.999.954.223.630","Men","D947C9CA81CEF801CD8CD633C0E9B483",10
22140,"3.410.550.011.135.630","Pants","Kenneth Cole Men's Five Pocket Strech Twill Pant","Kenneth Cole","79.5","Men","8A898F8ADE5848598D11AEE0FA0A1A30",6
22148,"1.905.615.043.654.880","Pants","Carhartt Men's Weathered Twill Pant Relaxed Fit","Carhartt","39.950.000.762.939.400","Men","DA28A523D750771722583165FD6D01D9",3
22153,"2.538.700.001.500.540","Pants","Kenneth Cole Men's Herringbone Five Pocket Pant","Kenneth Cole","53.0","Men","73835D50763E540BB9F3D888451AEC23",6
22156,"6.137.309.803.972.540","Pants","Allegra K Mens 2012 NEW Skull Pattern Casual Sports Shorts Pants Light Gray W34","Allegra K","13.729.999.542.236.300","Men","0477B724BF16E35F2CCEFC68351AFCA4",9
22173,"666.810.000.166.297","Pants","J.Lindeberg Men's Troyan Reg Micro Twill Pant","J.Lindeberg","139.5","Men","02C027CDCB67DCD4D033940E372408E2",7
22175,"9.314.460.202.821.490","Pants","Allegra K Men Belt Loop Slant Pockets Button Closure Baggy Pants Black W33","Allegra K","22.020.000.457.763.600","Men","50D944A1F44B855A5144C17E8FC33973",9
22183,"25.882.500.031.031.600","Pants","Quiksilver Young Men's Dane 2 New Slim Tapered Fit Pant","Quiksilver","59.5","Men","35CA20541074B1DF74604CF1E228E13F",9
22185,"12.505.829.887.574.600","Pants","Dickies Mens Relaxed Straight Fit Pant","Dickies","29.989.999.771.118.100","Men","A9EFF89DAA0DD80A9AF1FC1BED016A9F",1
22188,"12.339.400.328.612.300","Pants","Concitor Men's Dress Pants Slacks Flat Front Trousers Orange","Concitor","29.950.000.762.939.400","Men","C1A79E7F0D5D27DE57B7FF4C3CCAF1B5",2
22193,"2.116.608.050.195.690","Pants","Geoffrey Beene Men's Charcoal Solid Suit Separate Pant","Geoffrey Beene","50.880.001.068.115.200","Men","62F6BCEB09ED4B4C9E39A79BABBA985E",6
22195,"21.199.040.804.497","Pants","Calvin Klein Sportswear Men's Coated Ultra Slim Pant","Calvin Klein","427.400.016.784.668","Men","15E59BC75A6EC0F6874D653A36596549",3
22199,"8.148.800.016.194.580","Pants","Earnest Sewn Men's Fulton Straight Leg Corduroy Pant","Earnest Sewn","176.0","Men","A3F51ED7621FC3C5A6BD5ABD3AC8789C",1
22233,"30.606.698.721.709.800","Pants","G-Star Men's Arc 3D Loose Tapered Braces Pant","G-Star","7.269.999.694.824.210","Men","9268B90EE8AFD29AD0D12427BF27FBA6",10
22234,"13.445.999.655.738.400","Pants","Perry Ellis Microfiber Big Mens Dress Pant Black","Savane","298.799.991.607.666","Men","D33DAA6FF4705FB9692EE1A9D1D9CD4E",4
22242,"12.494.999.885.559.000","Pants","Tru-Spec 60/40 Cotton Polyester Basic BDU Pants","Tru-Spec","24.989.999.771.118.100","Men","21B6529DE735E29783012AB4F9CE604D",2
22255,"5.366.400.014.609.090","Pants","Foothills Cargo Pants Khaki","Orvis","129.0","Men","96E76CC974CF7BDCC09B86BFAD3EEE35",8
22263,"1.897.837.081.484.690","Pants","Ed Garments Men's Waistband Pleated Pant. 2610","Ed Garments","409.900.016.784.668","Men","832F64B04453D8697CD600B74B14A1AD",7
22268,"15.926.919.506.819.800","Pants","Tommy Hilfiger Slim Fit Pants","Tommy Hilfiger","3.627.999.877.929.680","Men","A6796468415AD36C01489F48C573CF7B",1
22308,"30.174.970.985.508.200","Pants","Dockers Men's Limited Offer D2 Stretch Khaki Pant","Dockers","599.900.016.784.668","Men","4B6E16D36F691EEC61154D01871CEC76",7
22309,"6.668.999.879.233.530","Pants","Allegra K Mens Baggy 2012 NEW Casual Pants Slim Half Trousers Slacks Deep Blue W33","Allegra K","1.481.999.969.482.420","Men","9978F8C43C1E939CAF27C50179266B55",9
22310,"40.545.000.130.310.600","Pants","Calvin Klein Sportswear Men's Step Weave Dylan Pant","Calvin Klein","79.5","Men","102E333DD822C1D9E0592ECF075E4BF4",3
22323,"4.713.800.005.987.280","Pants","Polo Ralph Lauren Slim Fit Kahki Pants","Polo Ralph Lauren","98.0","Men","A8B9B4F9211D7B723D78D29AD11F5CB5",2
22327,"1.618.188.057.651.630","Pants","Haggar Men's Stria Double Pleat Front Cuff Suit Separate Pant","Haggar","37.720.001.220.703.100","Men","83C5E87562B294B468AC06EA06919851",6
22338,"42.630.000.051.110.900","Pants","Polo Ralph Lauren Men Linen Pants","Ralph Lauren","98.0","Men","96DC193D7A9AB734F072C7D831CB281A",10
22360,"2.147.200.007.736.680","Pants","Affazy Charcoal Pleated Slacks","Affazy","44.0","Men","3AA032C050C662B5A61369EEA82681C1",2
22364,"40.275.000.100.024.000","Pants","Polo Ralph Lauren Mens Slim-fit 5-pocket Chino Pants Boating Kahki","Polo Ralph Lauren","89.5","Men","0E11D3D6172598B850BC8BF9837C2792",2
22367,"4.508.000.008.761.880","Pants","MDP104 Men's Ballroom Latin Competition Practise Dance Pants","Star Dancewear","98.0","Men","CE1B4E4C2781AD3735C98990221D93A6",9
22370,"17.005.140.865.788.400","Pants","Geoffrey Beene Men's Flat Front Dress Pant","Geoffrey Beene","349.900.016.784.668","Men","1DB9D897D180110CB04679E84A1EEF53",6
22375,"4.839.900.018.274.780","Pants","Paul Fredrick 100% Wool Gabardine Pleated Front Pants","Paul Fredrick","109.5","Men","AC66722E68274048BD8CC378B8517436",5
22389,"3.039.600.004.255.770","Pants","Brixton Men's Reserve Slim Fit Pant","Brixton","68.0","Men","46CA21DBD421969E00792C3CAE595065",2
22400,"4.463.503.888.142.760","Pants","Ralph Lauren Mens Double Pleated Brown Wool Dress Pants","Ralph Lauren","8.998.999.786.376.950","Men","D9663E409CED6F5A8BE7614C4A90A701",10
22408,"7.315.000.025.555.490","Pants","BALLIN Men's Super 120's Gaberdine Dunhill Pant","Ballin","175.0","Men","57D69B8C4D53A3FDCAE582B026285CA9",2
22414,"30.174.970.985.508.200","Pants","Nautica Men's Dress Pant","Nautica","599.900.016.784.668","Men","CDFC98D231A27426AF33906C0A12D319",8
22416,"6.526.200.015.097.850","Pants","Premium Moleskin Field Pants Lovat","Orvis","149.0","Men","56B224E5D5EC807C6CB29F34D8CC6213",8
22418,"7.276.500.024.832.780","Pants","J.C. Rags Men's Striker-Super Low Crotch Pant","J.C. Rags","45.428","Men","8821368051493F5497EB23FA0F708DCD",1
22453,"2.722.500.005.736.940","Pants","Berle Mens Pleated Dress Pants Taupe Worsted Wool Trousers Slacks Stain Resistant Milan","BERLE","55.0","Men","FC1671E392A4646FDC594A1E58AC635C",3
22456,"3.491.400.006.785.980","Pants","American Apparel Twill Welt Pocket Pant","American Apparel","69.0","Men","0693DF4AA5DE496FF23D0AE36E50C276",8
22457,"23.760.000.001.639.100","Pants","Berle Mens Pleated Dress Pants Brown Worsted Wool Trousers Slacks Stain Resistant Milan","BERLE","55.0","Men","CE4803F46AF6CC63C81BDE4FA8996638",3
22479,"48.902.000.166.475.700","Pants","Santa Fe Washed-twill Pants Sahara Tan","Orvis","98.0","Men","C6B9468CE732C6EAD632EA051C4E9743",8
22486,"240.451.908.378.838","Pants","Kenneth Cole Men's Pinstripe Five Pocket Pant","Kenneth Cole","499.900.016.784.668","Men","C1BC72568D36176DA6F0BB5C451D90AA",6
22503,"807.350.001.297.891","Pants","Perry Ellis Portfolio Neo-luxe Dress Pants","Perry Ellis","16.75","Men","7B7DF56F467D96C8F817D24E6C75FB51",6
22504,"6.968.000.018.969.170","Pants","Perry Ellis Portfolio Mens Pleated Folio-flex Dress Pants","Perry Ellis","16.75","Men","14504681BE13951F43AEB5B6B76DAB0D",6
