"id","cost","category","name","brand","retail_price","department","sku","distribution_center_id"
13874,"3.347.809.887.311.010","Accessories","Hollywood Solid Pashmina Scarf","boxed-gifts","7.989.999.771.118.160","Women","18FC3B6CC1E55CCEA877C161E2E9BA27",10
13876,"376.962.290.411.745","Accessories","Oakley Women's Miss Conduct Asian Fit Sunglasses","Oakley","9.998.999.786.376.950","Women","25E2D0317E892210F0BFED6B1A96D1E6",8
13880,"6.839.999.981.224.530","Accessories","LibbySue-Cascade of Flowers Crinkle Scarf","LibbySue","18.0","Women","1DBCCA5262F495A41DA945B2851ED2DE",8
13915,"1.903.986.064.622.860","Accessories","Karakoram Design 100% Pashmina Shawl Scarf Wrap Stole Throw","Pashmina","459.900.016.784.668","Women","710AAD3ADA51C8B318F927082D8CAE6D",2
13925,"3.448.439.864.649.470","Accessories","Kate Spade Women's Ally Polarized Aviator Sunglasses","Kate Spade","9.269.999.694.824.210","Women","E7F9EF5AB27988091ED7BA2CAE40384E",1
13938,"19.796.040.580.684.300","Accessories","WARMEN Super Long 22 Women Genuine Soft Nappa Leather Opera Gloves","WARMEN","499.900.016.784.668","Women","CF3B784C8593890043B17E24088125D4",4
13960,"4.906.719.834.177.490","Accessories","Show Girl Chic Tall Fur Leg Warmers","boxed-gifts","13.479.999.542.236.300","Women","570F6FF5228E5AB43AF45555C8710998",10
13979,"1.711.709.994.816.180","Accessories","Dainty Cotton Handkerchief with Crochet Edges","Greatlookz","3.990.000.009.536.740","Women","D3636814355D8734527D64D9A229ACC3",3
13990,"4.445.399.900.911.740","Accessories","Wrap - Textured Silk","Red Blossom","11.949.999.809.265.100","Women","042886829869470B75F63DDDFD7E9D9D",8
14002,"7.933.589.892.629.380","Accessories","Carhartt Women's  Embroidered C Knit Hat","Carhartt","17.989.999.771.118.100","Women","86158A6B3924670A32DAD65BBC41BD95",3
14010,"6.297.999.971.546.230","Accessories","Trendy Solid Jersey Infinity Scarf","Ecoscapes","16.75","Women","076FE937E59C252325E2A760AE2E4D37",2
14015,"375.870.981.112.212","Accessories","Wool Fashion French Beret Black","Private Island","91.899.995.803.833","Women","FB7B1850BA96E427E01404C3ED805CC2",7
14018,"31.379.398.508.495.000","Accessories","Croakies Unisex Adult Terra Spec Cord Adjustable Eyewear Retainer","Croakies","89.399.995.803.833","Women","EBC82DDCAA790D66BBA665311EAD3045",4
14053,"25.104.780.612.574.200","Accessories","Under Armour Surge Sport Sunglasses","Under Armour","594.900.016.784.668","Women","249B96BD669D584DE425CC8761D2CA9F",10
14076,"5.173.153.888.477.290","Accessories","Rebecca Minkoff Large Zip Wallet Bridal 15ZESDXF12 Wallet","Rebecca Minkoff","11.598.999.786.376.900","Women","3F2798418E4BAD12EF063CB9300805BD",1
14114,"7.781.040.067.427.820","Accessories","Isotoner Women's Unlined Gloves","Isotoner","1.926.000.022.888.180","Women","CBE68589759F566354B16B634B2AC6B8",1
14124,"2.559.999.990.463.250","Accessories","Columbia Women's Bugaboo Interchange Glove","Columbia","64.0","Women","7DD6AF0D70340195C48C002EBE5E4AAC",6
14129,"4.345.649.887.038.760","Accessories","Navy Blue Braided Elastic Stretch Belt","Luxury Divas","9.989.999.771.118.160","Women","A7D4C5E52848263151F75565644E7367",1
14144,"15.657.900.252.361.600","Accessories","Women's Winter Leather Mittens with Finger Liners(Many colors)","Leather Gloves Online","38.950.000.762.939.400","Women","636B1370D6DFAE91F2042EEF96C994B1",7
14147,"639.015.026.161.298","Accessories","Ladies Winter Fancy Dressy Wool Magic Touch Screen Thumb Index Gloves Gray Char","SK Hat shop","16.950.000.762.939.400","Women","E5770A47472445B3F839A58A32B8ABE5",2
14154,"3.543.749.985.983.590","Accessories","Ray-Ban RX5245 Eyeglasses","Ray-Ban","87.5","Women","C4D2B56920CEDD39CF578DCBC2BA960A",2
14155,"4.419.557.885.017.060","Accessories","Oakley Women's Deception Metal Sunglasses","Oakley","9.998.999.786.376.950","Women","CF5CF27E4A8ED0EA16A917C2EB79EFF5",8
14158,"17.391.450.435.253.900","Accessories","Coach Julia Legacy Stripe ID Card Case 46800 Multi","Coach","489.900.016.784.668","Women","62854D0EF411B0656645617B8F48D876",3
14161,"31.534.999.944.269.600","Accessories","Women's Italian Leather Gloves Lined in Silk. 4bt . In Many Colors. By Solo Classe.","Solo Classe","85.0","Women","2298D401E38ECD89706918103116CA07",5
14165,"7.577.009.879.476.860","Accessories","Black and White Houndstooth Pashmina Scarf 12w","Teramasu","18.989.999.771.118.100","Women","2D280461B029134123F1F1A356E176B1",5
14170,"11.859.000.150.532.400","Accessories","HDE Ladies Fashion Leather Skinny Belt with Bow Buckle & Gold Accents","HDE","2.950.000.047.683.710","Women","C5FE17B7A8D023ADE2BBB05E574EEF78",1
14175,"3.126.384.118.868.020","Accessories","Hobo  Women's Anya VN-20011AMB Wallet","HOBO","7.237.000.274.658.200","Women","A3DFEC8B6A89762B454F0B5E660C2E78",7
14185,"1.049.910.987.235.540","Accessories","Carhartt Women's Perforated Belt","Carhartt","26.989.999.771.118.100","Women","A0CCE36DE7A1457B6802255FCEC69081",3
14192,"2.261.639.938.324.350","Accessories","New Trendy Pixel Shape Wayfarer Sunglasses","106Shades","5.639.999.866.485.590","Women","0AAF61723A352BA7EA1BE4502DF85765",6
14215,"2.603.520.065.310.890","Accessories","Radiant Navy Blue Pleated Turban Hat Head Cover Sun Cap","Aquapro","678.000.020.980.835","Women","8BE904AD045C578053FC6052578F9324",3
14230,"10.447.979.871.730.300","Accessories","WARMEN Ladies Genuine Kid Leather Gloves with Decorative White Stitching Bow","WARMEN","25.989.999.771.118.100","Women","60BBA73587DE9C81E7EB9A508EF928B7",4
14231,"7.836.079.872.895.100","Accessories","Western Raffia Tea Stained","Florida Hat Company","19.989.999.771.118.100","Women","CFCFC30E3761DBEF9FA08C44799F5AE5",2
14241,"74.562.698.708.395.600","Accessories","Rolfs Leather Classic Double Zip Around Clutch","Rolf's","19.989.999.771.118.100","Women","7551E734ECFA518DB7C1E6175ABE5BFB",3
14249,"787.720.025.127.679","Accessories","Kenneth Cole Reaction Womens Clutch Wallet Trifold Textured Glazed W Coin Purse","Kenneth Cole REACTION","20.950.000.762.939.400","Women","2AC82ABFBBBA61CC903D25F55ED38AA8",1
14279,"485.757.987.623.483","Accessories","Ear Muffs-Purple W20S30F","G & S","10.989.999.771.118.100","Women","2F0F2F6DA6992B9CA06B907A9E803296",8
14290,"9.316.550.262.522.690","Accessories","Bella Taylor Carnevale Quilted Cotton Wristlet Wallet","Victorian Heart Co. Inc.","23.950.000.762.939.400","Women","1CBD0A834AD09F5650B3536F90478F25",2
14292,"28.684.098.968.768.100","Accessories","New Gradual Curves with Floral Design Viscose Scarf","boxed-gifts","7.989.999.771.118.160","Women","8D060ABE1E38AB179742BD3AF495F407",10
14294,"14.041.000.251.375.100","Accessories","DeepPocket Leather Money Clip Wallet Top Grain Cowhide with SeeId","DeepPocket","36.950.000.762.939.400","Women","5165BB7092845D883F5D8FD52D1F32B5",4
14297,"5.868.741.197.729.490","Accessories","Maui Jim Classic Sunglasses - Stingray - Gloss Black Frame w\ Neutral Grey Lens - 103-02","Maui Jim","14.349.000.549.316.400","Women","32F57C0FA63AF22A58598D1E0583ECE9",8
14301,"9.701.699.999.347.320","Accessories","Maui Jim Canoes Sunglasses - Polarized","Maui Jim","219.0","Women","901E70DA072BC616CAA6337421ABE4AE",8
14315,"6.334.399.990.737.430","Accessories","Coach Julia Leather Slim Zip Wallet 47388 (SV/Black)","Coach","148.0","Women","1AAA7438A59157A0F21AD30DDA4D4088",3
14335,"13.630.000.019.446.000","Maternity","BellaBand Women's Everyday Bellaband","BellaBand","29.0","Women","4C4F120E57EA9448CCB7A07C48DF40FF",1
14336,"2.584.799.933.922.290","Accessories","Allegra K Women Press Stud Button Dotted Gauze Coated Bow Tie Decoe Black Waist Belt","Allegra K","7.179.999.828.338.620","Women","319E33A217F7368FF7CEEF7731CCF024",9
14357,"7.040.599.794.895.940","Maternity","Motherhood Maternity: Long Sleeve V-neck Maternity T Shirt","Motherhood Maternity","14.979.999.542.236.300","Women","E8CB5F581442030021D62FD780FA674D",3
14363,"21.264.000.065.624.700","Maternity","Goddess Women's Keira Nursing Bra","Goddess","48.0","Women","785CF0A5DEF4977E0210F07E0F925FA1",9
14373,"7.312.000.036.239.620","Maternity","Momo Maternity Women's Hooded Quilted Pattern Detail Down Coat with Faux Fox Fur Trim","Momo Maternity","160.0","Women","7FA2C598BE3498BAEAD8D1D2C4485AB9",2
14376,"12.150.000.035.762.700","Maternity","Lamaze Maternity Nursing Camisole","Lamaze","25.0","Women","761A0C714184CAB2456D17BDFBB8D550",1
14379,"496.117.006.921.947","Maternity","Allegra K Women Boat Neck Gold Tone Zipper Decor Burgundy Kint Sweater S","Allegra K","12.130.000.114.440.900","Women","6F7BC4BAEB295716FA1DBBF64887FCFF",9
14381,"15.076.379.863.168","Maternity","Motherhood Maternity: Short Sleeve Scoop Neck Nursing Pajama Set","Motherhood Maternity","3.497.999.954.223.630","Women","235FBA44E32BA4DD3A3F72DB1A8A6846",3
14384,"9.825.059.829.606.260","Maternity","Motherhood Maternity: Sports Clip Down Nursing Bra","Motherhood Maternity","21.979.999.542.236.300","Women","43A87A86EA9AEE0255325E2865D6B503",3
14421,"9.846.059.941.100.470","Maternity","Maternity Top - Short Sleeve - Mommy Paradise","Mommy Paradise","24.989.999.771.118.100","Women","036AD3E516C5BF3A4B3BE35B137BCBB8",7
14423,"9.890.999.818.570.910","Maternity","Motherhood Maternity: Sleeveless Clip Down Double Opening Ruched Nursing Cami","Motherhood Maternity","21.979.999.542.236.300","Women","37A2DFF33C3DA75C1EA08BE45A9F8DA6",3
14434,"9.620.000.049.471.850","Maternity","A Pea in the Pod: Sueded Opaque Tight","A Pea in the Pod","20.0","Women","E1F9B39289E1893622852CF8DE6E14DB",7
14438,"2.297.700.039.561.090","Maternity","Belly Bandit post pregnancy belly wrap original Black","Belly Bandit","49.950.000.762.939.400","Women","F78A3FBFF320D57C670AF3FCDAFEBC7E",9
14441,"10.595.250.171.491.800","Maternity","Devon & Jones Pink Women's Velour Lounge Pants DP410W","Devon & Jones","2.493.000.030.517.570","Women","1F30C0CE8636FF2C424549971DCAB5D8",7
14446,"11.990.550.366.450.800","Maternity","Mommy Paradise Maternity Top 3615","Mommy Paradise","27.950.000.762.939.400","Women","6EC3FF0C922CE84561CE5162F912B47E",7
14458,"5.663.100.016.687.530","Maternity","Momo Maternity Women's Wool Blend 'Kennedy' Toggle Button Coat","Momo Maternity","129.0","Women","7E8DAE845C0913D1BFF36953378DF627",2
14462,"4.425.600.010.156.630","Maternity","Atlas Band Combo: Pregnancy Band and Postpartum Accessory","Atlas","96.0","Women","4F9EF38EDCFC460A00CBB8ED5DEE299C",7
14469,"15.815.480.809.241.900","Maternity","Sophia Sleeveless Babydoll Maternity/Nursing Top - Choose from Purple Turquoise and Black","Ecoscapes","349.900.016.784.668","Women","CAEED832AB664F42BC7EBE8A0EA0EDC6",2
14484,"8.099.459.812.515.370","Maternity","Motherhood Maternity: Short Sleeve Scoop Neck Maternity T Shirt","Motherhood Maternity","16.979.999.542.236.300","Women","FEAE21BB32B7B4AA690FAB151B60B598",3
14489,"26.969.800.162.655.100","Maternity","Motherhood Maternity: Sheer Maternity Pantyhose With Lycra Spandex","Motherhood Maternity","5.980.000.019.073.480","Women","8EFE4FF08D6F51DB0F7179FBEF12F2F1",3
14492,"16.404.029.771.381.300","Maternity","Wire-free Nursing Bra","Leading Lady","3.438.999.938.964.840","Women","5AE81DAA87D6649DF09002741E5B1738",3
14495,"1.355.095.983.642.420","Maternity","Motherhood Maternity: Long Sleeve Jersey Knit Hooded Maternity Jacket","Motherhood Maternity","29.979.999.542.236.300","Women","45E0E538B89751332E2055013FE7AC3E",3
14498,"13.741.259.983.954.700","Maternity","Preggers Maternity Pantyhose 10-15mmHg Gradient Compression Hosiery","Preggers","28.989.999.771.118.100","Women","2F5C6C71D7605196314FC5E5873E4DC5",3
14499,"2.369.999.997.317.790","Maternity","Mermaid Maternity V Insert Tankini Top","Mermaid Maternity","60.0","Women","6910A0F1EFF035477FF9F52993EBF0B1",2
14503,"12.114.019.820.194.200","Maternity","Motherhood Maternity: Short Sleeve Sash Belt Maternity Blouse","Motherhood Maternity","26.979.999.542.236.300","Women","CB03474483E366B5C8DD9F4A2A7537C1",3
14511,"20.395.920.675.875.500","Maternity","Smocked Waist Dual Maternity and Nursing Dress - Choose from Blue or Dark Violet","Ecoscapes","499.900.016.784.668","Women","BDE7B6425042BC526F895B0DDF422AE9",2
14516,"16.135.920.112.740.100","Maternity","Maternal America Women's Maternity Belly Support Leggings","Maternal America","3.684.000.015.258.780","Women","4776DA547036453F71AB92AAD7C727BD",5
14536,"22.792.000.085.115.400","Maternity","Le Mystere Women's Florence Nursing Bra  #161","Le Mystere","56.0","Women","CB8F68E75A1DC196C58D28A791E9E5ED",8
14550,"23.364.000.093.191.800","Maternity","Panache Sophie Maternity Bra (5821)","Panache","59.0","Women","03E03424A898E574153A10DB9A4DB79A",6
14562,"14.304.000.049.829.400","Maternity","BellaBand Women's Lace Bellaband","BellaBand","32.0","Women","1772C976B13A8C7B23BE3976965DD543",1
14563,"3.152.014.916.729.770","Maternity","Womama Ocean Dreams Adapt Full-Cup Nursing Bra","Womama","6.498.999.786.376.950","Women","A4F3E2A65158F75932ACAFCD57D5142C",7
14571,"118.155.398.125.118","Maternity","Motherhood Maternity: Petite Fold Over Belly Jersey Knit Maternity Yoga Pants","Motherhood Maternity","24.979.999.542.236.300","Women","6DC4166C5AA3123F245A786381D0EB9C",3
14580,"4.672.800.028.324.120","Maternity","NOM Women's Maternity Aurora Maxi Dress","NOM","99.0","Women","231EB5A29F502174B938F4BD140E19C6",8
14592,"20.194.000.059.505.900","Maternity","Lilo Maternity Cotton Cable V-neck Sweater","Lilo Maternity","46.0","Women","C51C55CEC7054DD833F192A7895B378C",6
14601,"1.768.200.008.198.610","Maternity","Three Seasons Maternity Women's Boot Cut Jean","Three Seasons Maternity","42.0","Women","050B8CBE360FB66FE566AAE25CD800DF",8
14604,"2.055.779.937.483.070","Maternity","Bravado The Bliss Womens Nursing Bra","Bravado! Designs","4.859.999.847.412.100","Women","F2B41808A36363E7279128BF0B6104F1",4
14611,"3.187.800.008.431.070","Maternity","NOM Women's Maternity Julie Dress","NOM","69.0","Women","BA2C75B065956EBEB0579A0B66453258",8
14617,"719.433.030.637.473","Maternity","The Olian Cotton Nursing 4pc. Pajama Set","Olian","15.210.000.610.351.500","Women","FB6A253729096C1E92E43C26A6FDADC3",2
14622,"1.259.965.984.130.290","Maternity","Motherhood Maternity: Spaghetti Strap Deep V-neck Lace Trim Nursing Nightgown","Motherhood Maternity","26.979.999.542.236.300","Women","A1C71B134D46D7F7FF00F488874A8D43",3
14625,"13.031.339.854.482.400","Maternity","Motherhood Maternity: Under Belly 5 Pocket Maternity Shorts","Motherhood Maternity","26.979.999.542.236.300","Women","977A265611C4DCD4FB5F47801D97B9A7",3
14629,"14.520.000.033.080.500","Maternity","BellaBand Organic","Ingrid & Isabel","30.0","Women","0C0134E3AB253FC5F690B64D9339BA38",4
14636,"13.700.859.858.705.900","Maternity","Motherhood Maternity: Long Secret Fit Belly(r) Signature Pocket Boot Cut Maternity Jeans","Motherhood Maternity","29.979.999.542.236.300","Women","C5AF1DFDE10402285102771AD64B3DAC",3
14638,"2.347.650.039.207.560","Maternity","Belly Bandit post pregnancy tummy wrap belly band original Nude","Belly Bandit","49.950.000.762.939.400","Women","322D830DA1130169FB4CA1C7543799D0",9
14639,"14.140.000.101.178.800","Maternity","Bravado Plus Original Nursing Bra Style 1012","Bravado! Designs","35.0","Women","DD4143061640D55FB312DD0CE8AFA76E",4
14654,"19.719.150.384.156.400","Maternity","Jules & Jim Women's Maternity  Pant","Jules & Jim","48.450.000.762.939.400","Women","BEA99816975D4154590D05CE68DA8B63",3
14665,"3.577.300.014.346.830","Maternity","Criss Cross nursing maternity pajamas - XS-L","Annee Matthew","83.0","Women","54AC2D9E6B288F513ABF0C1E0633D672",1
14674,"14.061.959.905.632.700","Maternity","Motherhood Maternity: Petite Secret Fit Belly(r) Bi-stretch Suiting Straight Leg Maternity Pants","Motherhood Maternity","3.497.999.954.223.630","Women","8239A17531BC8EDEA4AD8A2DDFDBBE17",3
14678,"1.191.545.982.705.890","Maternity","Motherhood Maternity: Under Belly Roll Hem Maternity Shorts","Motherhood Maternity","24.979.999.542.236.300","Women","5847AC0C8EFB8552D1B7C42A4C3F2418",3
14687,"3.645.719.877.637.840","Maternity","Mother TuckerTM Compression Nursing Tank - Nude - M","Belly Bandit","7.994.999.694.824.210","Women","99E5A6AE292728F981127B71861DE113",9
14694,"32.806.548.604.165.000","Maternity","Mother Tucker compression tank body shaper slimmer","Belly Bandit","6.994.999.694.824.210","Women","0806A60E2E5466094AB2652BEF28A251",9
14697,"14.450.870.715.626.600","Maternity","Julia Crossover Twist Pregnancy and Nursing Top","Ecoscapes","349.900.016.784.668","Women","D0EC7DEB55FED8949EFB61CF1FA39004",2
14717,"6.677.069.960.177.240","Maternity","Lace Cami Top and Boxer Shorts Lingerie Set","Angelina Hosiery","16.989.999.771.118.100","Women","0563CAD67522FC198DEE8690630E475A",3
14722,"1.607.195.991.844.770","Maternity","Motherhood Maternity: Long Sleeve Tie Detail Maternity Cardigan","Motherhood Maternity","3.997.999.954.223.630","Women","E417BAA9CDF34202F71B55A27DA899E8",3
14729,"13.024.700.408.007.200","Maternity","Mommy Paradise Maternity Top 4040","Mommy Paradise","27.950.000.762.939.400","Women","24E709BB46C4AE9841EECAC2A9E8C503",7
14737,"914.550.000.987.947","Maternity","A Pea in the Pod Collection: J Brand Secret Fit Belly(r) 5 Pocket Maternity Jeans","J BRAND","195.0","Women","7426F79C9A7F5AF0A6CC457B2A7FB195",7
14745,"1.929.641.986.662.320","Maternity","Motherhood Maternity: Long Sleeve Cable Knit Maternity Cardigan","Motherhood Maternity","4.497.999.954.223.630","Women","1EF4C899CD6F0D5CAE3A2EA3A91ADC1C",3
14752,"15.482.850.385.765.100","Maternity","Cotton Maxi Harem Pants Romper Jumpsuit","likemary","3.495.000.076.293.940","Women","85EBAD98D8A178BE8BAF16929526446E",3
14765,"24.250.000.156.462.100","Maternity","Melinda G 3000 Sutra Nursing Cami","Melinda G","50.0","Women","5554FC79D03D035FFF0A7BE9998332D2",2
14778,"2.516.800.005.733.960","Maternity","Flared Boucle Sweater","Nursing Mamas","52.0","Women","9167D3136C6495ED5E73160749D32625",5
14785,"45.671.000.177.040.600","Maternity","Sweet Mommy Satin Maternity and Nursing Dress","Sweet Mommy","109.0","Women","B04F44EACE1A193F15006E8A8A45624E",9
14787,"1.392.600.006.982.680","Maternity","Three Seasons Maternity Women's Print Kimono Surplice Dress","Three Seasons Maternity","33.0","Women","B65ED3859F13C2E134A0C02D21ACFB64",8
14791,"11.640.679.833.583.200","Maternity","Motherhood Maternity: Long Sleeve Scoop Neck Twist Neck Detail Maternity T Shirt","Motherhood Maternity","24.979.999.542.236.300","Women","874DC8C9CD9006D9AACA0CB5AC550812",3
14795,"8.721.600.058.674.810","Maternity","Momo Maternity Women's Wool Blend 'Lauren' Belted Coat with Hood","Momo Maternity","184.0","Women","9AFFCA09BB44F24B070C4F89937667C8",2
14797,"9.730.259.771.710.030","Maternity","Motherhood Maternity: Convertible Sleeve Open Front Maternity Cardigan","Motherhood Maternity","19.979.999.542.236.300","Women","53885282FBFF8407B3B6E820B7830180",3
14803,"16.300.679.852.358.600","Maternity","Motherhood Maternity: Plus Size Petite Secret Fit Belly(r) Maternity Jeans","Motherhood Maternity","3.497.999.954.223.630","Women","7CE96E616CFD1A5CAA4127A0CE4BD7FD",3
14809,"16.615.499.834.686.500","Maternity","Motherhood Maternity: Convertible Sleeve Button Detail Maternity Tunic","Motherhood Maternity","3.497.999.954.223.630","Women","4042D0C6A49921C64C6406C8921C9139",3
14814,"633.653.981.261.611","Maternity","Motherhood Maternity: 3 Pack Maternity Bikini Panties","Motherhood Maternity","14.979.999.542.236.300","Women","173E2619A507A324EB10F969DF13A372",3
14815,"13.375.539.939.702.500","Maternity","Comfy Essential Maternity and Nursing Tee Long Sleeves","Ecoscapes","29.989.999.771.118.100","Women","E1490523B8CD2C130B29656613850CF8",2
14826,"3.856.000.006.198.880","Maternity","Impact Fitness - Maternity Fleece Lined Active / Yoga Pants (32 or 34 Inseam)","Impact Fitness","80.0","Women","58EAA69D86C0BB41C0F334B95B6C8CF2",4
14827,"3.754.800.013.080.230","Maternity","Jules & Jim Women's Classic Wrap","Jules & Jim","84.0","Women","FB50EF2594DAFF9DD6322CBB5489BCBC",3
14837,"11.732.609.948.917.600","Maternity","Hot Milk Women's Luminous French Knicker","HOTmilk","2.490.999.984.741.210","Women","B619892E6DF1FDAF1EB92ED22A80914A",3
14840,"8.148.000.052.571.290","Maternity","Layered look formal Nursing and Maternity Dress","Sweet Mommy","168.0","Women","A2A394D317AE9D89985646FA98565F36",9
14850,"2.489.800.012.484.190","Maternity","Motherhood Maternity: Jessica Simpson Secret Fit Belly(r) 5 Pocket Boot Cut Maternity Jeans","Motherhood Maternity","59.0","Women","DB0D4963149C89B0CC76FFD6AAACF002",3
14859,"858.600.003.272.295","Maternity","BirthandBaby Sleep Bra","BirthandBaby","18.0","Women","C064251D2C99ADBEE465C50F05BDA944",9
14860,"22.888.999.987.393.600","Maternity","Postpartum Slimmer Shapewear for C-Section Incision Care - Available in Nude Sizes S/M or L/XL","Cpanty","47.0","Women","2D6F064D4B257E01D5595F970ED714FC",9
14878,"11.152.050.310.243.600","Maternity","Mommy Paradise Maternity Top 3572","Mommy Paradise","27.950.000.762.939.400","Women","0EE8B1EAFADAC937E6E03D8866CEF9BF",7
14879,"13.894.999.995.827.600","Maternity","A Pea in the Pod: Long Sleeve Scoop Neck Maternity T Shirt","A Pea in the Pod","35.0","Women","E98549A4CB29369FB6DBB48AB0B6E018",7
14883,"2.227.500.006.556.510","Maternity","A Pea in the Pod: Memory Foam Nursing Bra","A Pea in the Pod","55.0","Women","C22F802F4E2192468FBC9485E31D062F",7
14889,"10.961.459.823.423.000","Maternity","Motherhood Maternity: Sports Clip Down Nursing Bra","Motherhood Maternity","22.979.999.542.236.300","Women","AB0590A53625F02C33DB3355D65BCEE3",3
14904,"27.135.000.079.870.200","Maternity","Belabumbum Lotus Lace Black Maternity/Nursing Nightgown","Belabumbum","67.0","Women","D51F8F228DBEA3E6F3E6421385707F68",8
14921,"7.979.400.017.112.490","Maternity","A Pea in the Pod Collection: AG Jeans Secret Fit Belly(r) 5 Pocket Skinny Leg Maternity Jeans","AG Jeans","198.0","Women","D3989FD6BCF000EEBA6633FA4C003B6B",6
14933,"2.006.107.985.850.610","Maternity","Motherhood Maternity: Indigo Blue Secret Fit Belly(r) Cuffed Maternity Crop Jeans","Motherhood Maternity","4.497.999.954.223.630","Women","8D8875E24E23D69F253A077F447ED7C3",3
14936,"12.145.949.943.053.700","Maternity","Sexy Nursing Maternity Bra - Berry Monroe","You! Lingerie","29.989.999.771.118.100","Women","500D2E6424F6FE03447C9D3545E6B376",5
14938,"11.191.039.837.914.500","Maternity","Motherhood Maternity: Sleeveless Scoop Neck Stretch Fabric Nursing Nightgown","Motherhood Maternity","24.979.999.542.236.300","Women","A9FD61FC1D487CFACD6260DB596096C9",3
14947,"6.854.399.996.995.920","Maternity","Miss Me Maternity Jeans : Glam Fleur De Lis - Dark Blue","Miss Me","168.0","Women","6A600C968F4E6A843DCAF600C1694E42",3
14968,"11.902.059.814.693.900","Maternity","Motherhood Maternity: Convertible Sleeve Tie Front Maternity Tunic","Motherhood Maternity","29.979.999.542.236.300","Women","91E480D943DDA6147AFF2BD2DC418C96",3
14973,"142.018.797.964.257","Maternity","Motherhood Maternity: Secret Fit Belly(r) Ponte Stretch Fabric Skinny Leg Maternity Pants","Motherhood Maternity","3.497.999.954.223.630","Women","5CA1B0A18C411C3EBFC35C9DAD7DA921",3
14974,"17.105.219.778.238.500","Maternity","Motherhood Maternity: Long Sleeve Jersey Knit Hooded Maternity Pull Over","Motherhood Maternity","3.497.999.954.223.630","Women","5208093BCAF65DFEA07BDAB31D600223",3
14986,"10.282.500.050.961.900","Maternity","A Pea in the Pod: Sleeveless Scoop Neck Maternity Tank Top","A Pea in the Pod","45.434","Women","A2BB46E362D70A83673A822206F5062E",7
15012,"1.639.179.989.274.290","Maternity","Motherhood Maternity: Secret Fit Belly(r) Super Stretch Skinny Leg Maternity Jeans","Motherhood Maternity","3.997.999.954.223.630","Women","F8E8B1FEFF822753A39B21DE69259FD6",3
15022,"11.196.699.836.160.200","Maternity","Motherhood Maternity: Short Sleeve Lift Up Double Opening Side Ruched Nursing Top","Motherhood Maternity","26.979.999.542.236.300","Women","86B83F4A0EF92968BC1D225A5A7802BB",3
15048,"20.327.580.807.928.500","Maternity","For Two Fitness Signature Racerback Maternity Workout Tank","For Two Fitness","459.900.016.784.668","Women","77A44D5CFB595B3545D61AA742268C9B",4
15053,"4.380.000.012.461.090","Maternity","Juicy Couture Maternity : Velour Pants - Regal","Juicy Couture","100.0","Women","47348419F65E9FF93AB474A090E66A41",6
15054,"4.529.094.168.159.120","Maternity","Motherhood Maternity: Belted Maternity Coat","Motherhood Maternity","999.800.033.569.336","Women","D9A849054248CB8A75FAA6FAADB62507",3
15063,"15.015.000.033.192.300","Maternity","La Leche League Soft Cup Padded Bra Style 4214","La Leche League","33.0","Women","F39F6F54273CC68D91EB7443932A64AD",1
15067,"19.728.000.104.427.300","Maternity","Three Seasons Maternity Women's Long Sleeve Henley Rib Sweater Tunic","Three Seasons Maternity","48.0","Women","6C2962F5FD32E7CF54968B00CB4ECEA5",8
15069,"9.095.449.915.965.270","Maternity","Mommymilk® Nursing Nightshirt Tank Top - Black","MommyMilk®","19.989.999.771.118.100","Women","45E1EF0AFB76FEF33345FCAC011C18BB",1
15072,"11.577.500.053.681.400","Maternity","A Pea in the Pod Collection: BCBG Long Sleeve Exposed Zipper Maternity Dress","BCBGMAXAZRIA","275.0","Women","0A90E4944AFB2476C3021501C165A937",3
15073,"1.831.083.981.298.260","Maternity","Motherhood Maternity: Secret Fit Waistband Bi-stretch Suiting Fit And Flare Maternity Pants","Motherhood Maternity","3.997.999.954.223.630","Women","A122A3441DD463A8360CA951EF45F98A",3
15074,"2.525.400.009.099.390","Maternity","Mothers en Vogue Women's Maternity Auyama Tunic Top","Mothers en Vogue","51.75","Women","7A35F9CD32D949F8A278DCA777827318",2
15077,"2.243.999.976.426.360","Maternity","PregO Maternity Wear Women's Maternity Animal Roll Waist Bikini","Prego","52.799.999.237.060.500","Women","0A15350BDBBDD4B3BEDE03A525997CA4",3
15082,"13.356.899.853.920.900","Maternity","Motherhood Maternity: Long Sleeve Pull Over Button Front Nursing Top","Motherhood Maternity","3.297.999.954.223.630","Women","12CFBD88070F29EE643BA6A9D614F79B",3
15090,"11.829.500.015.825.000","Maternity","Black Denim Plus Size Maternity Skinnies Stretch Waist","FineBrandShop","45.441","Women","0F2CDAB3B6CD72058596BAB972897F61",7
